pmcid	year	count	title	pubmedid
PMC3073924	2011	32978	Dynamics of distribution and efficacy of different spot-on permethrin formulations in dogs artificially infested with Dermacentor reticulatus	21447196
PMC3202818	2011	108022	Brown Spider (Loxosceles genus) Venom Toxins: Tools for Biological Purposes	22069711
PMC3092411	2011	47272	The AFHSC-Division of GEIS Operations Predictive Surveillance Program: a multidisciplinary approach for the early detection and response to disease outbreaks	21388561
PMC3060141	2011	57329	A further insight into the sialome of the tropical bont tick, Amblyomma variegatum	21362191
PMC3426335	2011	29831	Migratory birds, ticks, and Bartonella	22957116
PMC3045961	2011	87154	Functional genomics of the horn fly, Haematobia irritans (Linnaeus, 1758)	21310032
PMC3031531	2011	46791	Evidence for D1 Dopamine Receptor Activation by a Paracrine Signal of Dopamine in Tick Salivary Glands	21297964
PMC3109306	2011	36998	Toward an Understanding of the Perpetuation of the Agent of Tularemia	21687803
PMC3182641	2011	15581	RNA Interference in Ticks	21304465
PMC3025832	2011	50511	Assessment of bacterial diversity in the cattle tick Rhipicephalus (Boophilus) microplus through tag-encoded pyrosequencing	21211038
PMC7315328	2011	344693	Infectious Diseases	
PMC7332235	2010	1696816	Zoonoses	
PMC3294546	2010	7135	Rabbit Tularemia and Hepatic Coccidiosis in Wild Rabbit	21122253
PMC3002206	2010	5137	INVASIVE SPECIES: Do Noxious Neighbors Spread Disease?	21123147
PMC3000401	2010	63872	Development of Loop-Mediated Isothermal Amplification (LAMP) Assays for Rapid Detection of Ehrlichia ruminantium	21087521
PMC7119992	2010	544791	Systematic Survey of Zoonotic and Sapronotic Microbial Agents	
PMC3091747	2010	95105	Genomic survey of the ectoparasitic mite Varroa destructor, a major pest of the honey bee Apis mellifera	20973996
PMC2962654	2010	82137	Odorant-Binding Proteins of the Malaria Mosquito Anopheles funestus sensu stricto	21042539
PMC2953280	2010	30767	Thrombin Inhibitors from Different Animals	20976270
PMC3294399	2010	10033	Erythema Migrans_like Illness among Caribbean Islanders	20875293
PMC3200212	2010	47935	Expression of Heat Shock and Other Stress Response Proteins in Ticks and Cultured Tick Cells in Response to Anaplasma spp. Infection and Heat Shock	22084679
PMC2931678	2010	26540	Preparing the "New" Biologist of the Future: Student Research at the Interface of Mathematics and Biology	20810963
PMC2933639	2010	113601	Phylogenetic position of the acariform mites: sensitivity to homology assessment under total evidence	20678229
PMC2909256	2010	58014	MyD88-Dependent Signaling Contributes to Host Defense against Ehrlichial Infection	20668698
PMC3091647	2010	79543	An insight into the sialotranscriptome of the brown dog tick, Rhipicephalus sanguineus	20650005
PMC3224725	2010	98606	Comparative microarray analysis of Rhipicephalus (Boophilus) microplus expression profiles of larvae pre-attachment and feeding adult female stages on Bos indicus and Bos taurus cattle	20637126
PMC7027251	2010	27051	Formulations of Deet, Picaridin, and IR3535 Applied to Skin Repel Nymphs of the Lone Star Tick (Acari: Ixodidae) for 12 Hours	20695288
PMC2905322	2010	66137	Haplotypes that include the integrin alpha 11 gene are associated with tick burden in cattle	20565915
PMC2913006	2010	21659	Comparative efficacy of two fipronil spot-on formulations against experimental tick infestations (Ixodes ricinus) in dogs	20556429
PMC2901319	2010	94298	The expression of genes coding for distinct types of glycine-rich proteins varies according to the biology of three metastriate ticks, Rhipicephalus (Boophilus) microplus, Rhipicephalus sanguineus and Amblyomma cajennense	20529354
PMC2953995	2010	33894	Rickettsiae in Gulf Coast Ticks, Arkansas, USA	20409375
PMC2857863	2010	36427	Biology and ecology of the brown dog tick, Rhipicephalus sanguineus	20377860
PMC2853526	2010	138979	An insight into the sialome of Glossina morsitans morsitans	20353571
PMC2848250	2010	58367	Differential expression of genes in salivary glands of male Rhipicephalus (Boophilus)microplus in response to infection with Anaplasma marginale	20298599
PMC3322042	2010	59670	Potential for Tick-borne Bartonelloses	20202411
PMC3322032	2010	93441	Borrelia, Ehrlichia, and Rickettsia spp. in Ticks Removed from Persons, Texas, USA	20202419
PMC3322017	2010	71854	Blood Meal Analysis to Identify Reservoir Hosts for Amblyomma americanum Ticks	20202418
PMC3322007	2010	29703	Bartonella spp. Transmission by Ticks Not Established	20202410
PMC2813287	2010	42210	Rickettsial ompB Promoter Regulated Expression of GFPuv in Transformed Rickettsia montanensis	20126457
PMC2823692	2010	69943	An insight into the sialotranscriptome of the West Nile mosquito vector, Culex tarsalis	20089177
PMC2823657	2010	48047	Functional genomics tool: Gene silencing in Ixodes scapularis eggs and nymphs by electroporated dsRNA	20074328
PMC3385533	2009	17830	Laboratory Study on Biological Control of Ticks (Acari: Ixodidae) by Entomopathogenic Indigenous Fungi (Beauveria bassiana)	22808380
PMC3044516	2009	40938	A Groundhog, a Novel Bartonella Sequence, and My Father's Death	19998749
PMC3044512	2009	14792	Ehrlichia chaffeensis Infection of Sika Deer, Japan	19961683
PMC7104989	2009	43486	Infectious Hepatopathies in Dogs and Cats	19945087
PMC2802828	2009	36230	Burden of Tick-borne Infections on American Companion Animals	19945085
PMC2785768	2009	52345	Silencing of a putative immunophilin gene in the cattle tick Rhipicephalus (Boophilus) microplus increases the infection rate of Babesia bovis in larval progeny	19930572
PMC2819870	2009	9549	Rickettsia parkeri in Amblyomma americanum Ticks, Tennessee and Georgia, USA	19788817
PMC2741439	2009	46469	Directed evolution of a filamentous fungus for thermotolerance	19709419
PMC2764437	2009	97356	Analysis of complete genome sequence of Neorickettsia risticii: causative agent of Potomac horse fever	19661282
PMC2712238	2009	78637	Persistent Wolbachia and Cultivable Bacteria Infection in the Reproductive and Somatic Tissues of the Mosquito Vector Aedes albopictus	19633721
PMC2723117	2009	49847	Metapopulation structure for perpetuation of Francisella tularensis tularensis	19627585
PMC2714835	2009	49689	Silencing of genes involved in Anaplasma marginale-tick interactions affects the pathogen developmental cycle in Dermacentor variabilis	19607704
PMC7150115	2008	292913	Ocular Manifestations of Systemic Diseases	
PMC2711559	2009	50550	Major histocompatibility complex class II-dependent basophil-CD4+ T cell interactions promote TH2 cytokine-dependent immunity	19465906
PMC2694197	2009	67095	Promoter analysis of macrophage- and tick cell-specific differentially expressed Ehrlichia chaffeensis p28-Omp genes	19454021
PMC7152123	2008	203182	Disorders of the Brain	
PMC3011840	2009	32415	Evolution of the Gene Lineage Encoding the Carbon Dioxide Receptor in Insects	19613462
PMC2689274	2009	85489	Ixodes scapularis tick <underline>ser</underline>ine proteinase <underline>in</underline>hibitor (serpin) gene family; annotation and transcriptional analysis	19435496
PMC2695028	2009	55251	Babesia and its hosts: adaptation to long-lasting interactions as a way to achieve efficient transmission	19379662
PMC2701186	2009	138243	Reviewing molecular adaptations of Lyme borreliosis spirochetes in the context of reproductive fitness in natural transmission cycles	19368764
PMC2695030	2009	78831	The relationship between spotted fever group Rickettsiae and Ixodid ticks	19358804
PMC2679397	2009	13220	New developments in canine hepatozoonosis in North America: a review	19426444
PMC2680895	2009	117639	The complete mitochondrial genome of the house dust mite Dermatophagoides pteronyssinus (Trouessart): a novel gene arrangement among arthropods	19284646
PMC7149645	2009	84172	Agents of Emerging Infectious Diseases	
PMC2648658	2009	49896	Effects of Climate Change on Ticks and Tick-Borne Diseases in Europe	19277106
PMC2634635	2008	7982	Molecular Detection of Ehrlichia chaffeensis in Amblyomma parvum Ticks, Argentina	19046533
PMC2644717	2008	212855	Exploring the mialome of ticks: an annotated catalogue of midgut transcripts from the hard tick, Dermacentor variabilis (Acari: Ixodidae)	19021911
PMC2695023	2009	35144	Francisella tularensis: an arthropod-borne pathogen	18950590
PMC2584044	2008	70043	Key biosynthetic gene subfamily recruited for pheromone production prior to the extensive radiation of Lepidoptera	18831750
PMC3755191	2008	25715	Production of Aerial Conidia of Lecanicillium lecanii 41185 by Solid-State Fermentation for Use as a Mycoinsecticide	23997622
PMC2500193	2008	56502	Evidence of the Importance of Host Habitat Use in Predicting the Dilution Effect of Wild Boar for Deer Exposure to Anaplasma spp	18714379
PMC2500217	2008	84438	Relaxation of Selective Constraints Causes Independent Selenoprotein Extinction in Insect Genomes	18698431
PMC2600373	2008	19137	Identification of Residual Blood Proteins in Ticks by Mass Spectrometry Proteomics	18680654
PMC2474969	2008	53272	Prevalence and Infection Load Dynamics of Rickettsia felis in Actively Feeding Cat Fleas	18665265
PMC2410133	2008	143764	Insight into the sialome of the castor bean tick, Ixodes ricinus	18489795
PMC2396651	2008	13518	The first report of human illness associated with the Panola Mountain Ehrlichia species: a case report	18447934
PMC2394526	2008	48774	Geographic distribution and genetic diversity of the Ehrlichia sp. from Panola Mountain in Amblyomma americanum	18433500
PMC2373776	2008	71305	Enhanced spatial models for predicting the geographic distributions of tick-borne pathogens	18412972
PMC2358886	2008	129931	Evolution of pharmacologic specificity in the pregnane X receptor	18384689
PMC2386130	2008	34852	RNAi-mediated gene silencing in tick synganglia: A proof of concept study	18366768
PMC2323435	2008	95130	A critical analysis of disease-associated DNA polymorphisms in the genes of cattle, goat, sheep, and pig	18350334
PMC2315649	2008	50280	Revealing pancrustacean relationships: Phylogenetic analysis of ribosomal protein genes places Collembola (springtails) in a monophyletic Hexapoda and reinforces the discrepancy between mitochondrial and nuclear DNA markers	18366624
PMC2570823	2008	7390	Ehrlichia chaffeensis in Child, Venezuela	18325283
PMC2151134	2008	181974	Variability and Action Mechanism of a Family of Anticomplement Proteins in Ixodes ricinus	18167559
PMC2263054	2007	78635	Functional evolution of the vitamin D and pregnane X receptors	17997857
PMC3375809	2007	11466	Rocky Mountain Spotted Fever, Panama	18217566
PMC2075495	2007	33303	Gene knockdown by RNAi in the pea aphid Acyrthosiphon pisum	17903251
PMC2045677	2007	48654	Thyroid hormone receptor orthologues from invertebrate species with emphasis on Schistosoma mansoni	17727708
PMC2878212	2007	19849	Rocky Mountain Spotted Fever, Colombia	18214179
PMC2872717	2007	19825	Purification and characterization of two larval glycoproteins from the cattle tick, Boophilus annulatus	17519572
PMC1852332	2007	42527	Antibiotic Treatment of the Tick Vector Amblyomma americanum Reduced Reproductive Fitness	17476327
PMC1885961	2007	37249	Gene silencing of the tick protective antigens, Bm86, Bm91 and subolesin, in the one-host tick Boophilus microplus by RNA interference	17196597
PMC1796611	2007	33993	SCaFoS: a tool for Selection, Concatenation and Fusion of Sequences for phylogenomics	17288575
PMC7152373	2007	100472	Other Viral, Bacterial, Parasitic and Prion-Based Infectious Complications	
PMC3291351	2006	16435	Borrelia garinii in Seabird Ticks (Ixodes uriae), Atlantic Coast, North America	17326943
PMC1559625	2006	26656	Lymph node hemophagocytosis in rickettsial diseases: a pathogenetic role for CD8 T lymphocytes in human monocytic ehrlichiosis (HME)?	16859547
PMC3291064	2006	93102	Migratory Passerine Birds as Reservoirs of Lyme Borreliosis in Europe	16836825
PMC1457019	2006	52232	Climate, Deer, Rodents, and Acorns as Determinants of Variation in Lyme-Disease Risk	16669698
PMC1366493	2006	106759	Comparative Genomics of Emerging Human Ehrlichiosis Agents 	16482227
PMC3367652	2005	22781	Bartonella henselae in Porpoise Blood	16485476
PMC3367644	2005	29579	Francisella tularensis in the United States	16485467
PMC3320478	2005	42176	Epidemiology and Transmission Dynamics of West Nile Virus Disease	16102302
PMC7119033	2005	99810	Training Room Management of Medical Conditions: Infectious Diseases	16004916
PMC3371798	2005	7439	Third Borrelia Species in White-footed Mice	16032795
PMC3298254	2005	19889	Babesia microti, Upstate New York	15757571
PMC3320454	2005	28564	Rickettsial Infection in Animals and Brazilian Spotted Fever Endemicity	15752445
PMC7156010	2005	621969	Diagnostik und Management der wichtigsten Reiseund Tropenkrankheiten	
PMC3320305	2004	22842	Typing of Borrelia Relapsing Fever Group Strains	15498172
PMC3320273	2004	6507	Do Antiborrelial Antibodies Suggest Lyme Disease in Cuba?	15503414
PMC3320417	2004	27652	Spotted-Fever Group Rickettsia in Dermacentor variabilis, Maryland	15496254
PMC3320401	2004	29859	Rickettsia parkeri in Amblyomma triste from Uruguay	15496258
PMC3323343	2004	12054	Ehrlichia Prevalence in Amblyomma americanum, Central Texas	15338551
PMC3034327	2003	76924	Human Monocytotropic Ehrlichiosis, Missouri	14720399
PMC3016774	2003	24924	Ehrlichia chaffeensis Infections among HIV-infected Patients in Human Monocytic Ehrlichiosis_Endemic Area	14519250
PMC3000135	2003	45727	Relapsing Fever_Like Spirochetes Infecting European Vector Tick of Lyme Disease Agent	12781009
PMC524647	2003	105535	Practical uses for ecdysteroids in mammals including humans: an update	15844229
PMC7097468	2003	51504	Macrophage migration inhibitory factor: a regulator of innate immunity	14502271
PMC355923	2002	43343	Structure-based analysis of the ultraspiracle protein and docking studies of putative ligands	15455059
PMC2738504	2002	25515	Naturally Occurring Ehrlichia chaffeensis Infection in Two Prosimian Primate Species: Ring-tailed Lemurs (Lemur catta) and Ruffed Lemurs (Varecia variegata)	12498671
PMC405832	2002	524418	Fourth International Symposium on Molecular Insect Science	15455051
PMC2730327	2002	29659	Ehrlichia ewingii Infection in White-Tailed Deer (Odocoileus virginianus)	12095432
PMC355911	2002	46210	Ecdysteroid 7,9(11)-dien-6-ones as potential photoaffinity labels for ecdysteroid binding proteins	15455045
PMC2640811	1999	13605	New Rickettsiae in Ticks Collected in Territories of the Former Soviet Union	10603217
PMC7128100	1999	29761	Vaccination Practices in Veterinary Medicine: Standardization versus Tailored to Needs?	9890052
PMC7129187	1999	335354	Index	
PMC2590043	1984	1143	Lyme disease in New Jersey, 1978-1982.	6393614
PMC2590041	1984	498	Discussion: Epidemiologic Studies	
PMC2590013	1984	1014	Phagocytic cell responses to in vivo and in vitro exposure to the Lyme disease spirochete.	6393611
PMC7143654	2020	51289	Management Options for Ixodes ricinus-Associated Pathogens: A Review of Prevention Strategies	32178257
PMC7075944	2020	139298	Allergic Reactions and Immunity in Response to Tick Salivary Biogenic Substances and Red Meat Consumption in the Zebrafish Model	32211341
PMC7062246	2020	81708	A modeling workflow that balances automation and human intervention to inform invasive plant management decisions at multiple spatial scales	32150554
PMC7062937	2020	177047	A WAO - ARIA - GA2LEN consensus document on molecular-based allergy diagnosis (PAMD@): Update 2020<xref ref-type="fn" rid="d31e914">&#x2606;</xref>	32180890
PMC7131996	2020	31439	Effects of introduced sika deer (Cervus nippon) and population control activity on the distribution of Haemaphysalis ticks in an island environment	32274329
PMC7049397	2020	55496	Efficacy of a novel orally administered combination product containing sarolaner, moxidectin and pyrantel (Simparica Trio(tm)) against induced infestations of five common tick species infesting dogs in the USA	32113476
PMC7157729	2020	62363	Upscaling the Surveillance of Tick-Borne Pathogens in the French Caribbean Islands	32121571
PMC7168666	2020	61825	Evaluation of Disease Causality of Rare Ixodes ricinus-Borne Infections in Europe	32102367
PMC7070844	2020	35974	RNA Sequencing (RNA-Seq) Based Transcriptome Analysis in Immune Response of Holstein Cattle to Killed Vaccine against Bovine Viral Diarrhea Virus Type I	32098229
PMC7073187	2020	61442	New Perspectives in Food Allergy	32098244
PMC7078122	2020	37865	Prevalence of protozoan parasites in small and medium mammals in Texas, USA	32195108
PMC7157752	2020	62971	Quantitative Proteomics Identifies Metabolic Pathways Affected by Babesia Infection and Blood Feeding in the Sialoproteome of the Vector Rhipicephalus bursa	32092882
PMC7041427	2020	139621	Tick-Borne Encephalitis Virus Infection Alters the Sialome of Ixodes ricinus Ticks During the Earliest Stages of Feeding	32133301
PMC7029603	2020	58585	Identification of proteins from the secretory/excretory products (SEPs) of the branchiuran ectoparasite Argulus foliaceus (Linnaeus, 1758) reveals unique secreted proteins amongst haematophagous ecdysozoa	32070416
PMC7041860	2020	209995	Time-resolved proteomic profile of Amblyomma americanum tick saliva during feeding	32049966
PMC7012249	2020	93440	Classification and Staging of Morgellons Disease: Lessons from Syphilis	32104041
PMC7083353	2020	44565	Synanthropic rodents as virus reservoirs andtransmitters	32049206
PMC7088356	2020	48304	Synergistic China_US Ecological Research is Essential for Global Emerging Infectious Disease Preparedness	32016718
PMC7322545	2020	58140	Evasins: Tick Salivary Proteins that Inhibit Mammalian Chemokines	31679840
PMC7074884	2020	39373	Effects of Life Stage, Site, and Species on the Dragonfly Gut Microbiome	32012869
PMC6987236	2020	19629	Zwiesel bat banyangvirus, a potentially zoonotic Huaiyangshan banyangvirus (Formerly known as SFTS)_like banyangvirus in Northern bats from Germany	31992832
PMC7077237	2020	52988	RNA Viruses of Amblyomma variegatum and Rhipicephalus microplus and Cattle Susceptibility in the French Antilles	31991915
PMC6979332	2020	53774	IgG antibody response against Anopheles salivary gland proteins in asymptomatic Plasmodium infections in Narino, Colombia	31973737
PMC6979364	2020	39091	Expanded complement of Niemann-Pick type C2-like protein genes in Clonorchis sinensis suggests functions beyond sterol binding and transport	31973758
PMC6985549	2020	97967	Gene Expression in the Salivary Gland of Rhipicephalus (Boophilus) microplus Fed on Tick-Susceptible and Tick-Resistant Hosts	32039052
PMC6985576	2020	59992	Combining Citizen Science and Genomics to Investigate Tick, Pathogen, and Commensal Microbiome at Single-Tick Resolution	32038704
PMC7037407	2020	42230	Identification and Pilot Evaluation of Salivary Peptides from Anopheles albimanus as Biomarkers for Bite Exposure and Malaria Infection in Colombia	31973044
PMC6975024	2020	51202	The scale affects our view on the identification and distribution of microbial communities in ticks	31964404
PMC6994164	2020	75253	Invasive plants facilitated by socioeconomic change harbor vectors of scrub typhus and spotted fever	31961870
PMC7222858	2020	28294	Hypersensitivity Reactions to Biologicals: from Bench to Bedside	32435575
PMC6997490	2020	38232	Prevalence of common tick-borne pathogens in white-tailed deer and coyotes in south Texas	32025488
PMC7013009	2020	25755	Bartonella vinsonii subsp. arupensis infection in animals of veterinary importance, ticks and biopsy samples	32071727
PMC6961398	2020	48165	Comparative vector competence of North American Lyme disease vectors	31937369
PMC7157712	2020	40899	Alpha-Gal and Cross-Reactive Carbohydrate Determinants in the N-Glycans of Salivary Glands in the Lone Star Tick, Amblyomma americanum	31936588
PMC6943966	2020	36232	Description of Eschar-Associated Rickettsial Diseases Using Passive Surveillance Data - United States, 2010_2016	31895916
PMC6942265	2020	70067	Bovine ticks harbour a diverse array of microorganisms in Pakistan	31900233
PMC7022458	2019	31185	Effects of the Entomopathogenic Fungus Metarhizium anisopliae on the Mortality and Immune Response of Locusta migratoria	31906210
PMC6937756	2019	61785	Salivary gland proteome analysis of developing adult female Haemaphysalis longicornis ticks: molecular motor and TCA cycle-related proteins play an important role throughout development	31888749
PMC6937299	2019	59742	Exogenous and endogenous microbiomes of wild-caught Phormia regina (Diptera: Calliphoridae) flies from a suburban farm by 16S rRNA gene sequencing	31889104
PMC6929356	2019	77324	Histaminergic interneurons in the ventral nerve cord: assessment of their value for Euarthropod phylogeny	31890274
PMC7023149	2019	31820	Determining Effects of Winter Weather Conditions on Adult Amblyomma americanum (Acari: Ixodidae) Survival in Connecticut and Maine, USA	31877783
PMC6923977	2019	63625	Show us your ticks: a survey of ticks infesting dogs and cats across the USA	31856893
PMC7197698	2020	86169	Impact of Unexplored Data Sources on the Historical Distribution of Three Vector Tick Species in Illinois	31832656
PMC6932829	2019	139097	Re-assessing the diversity of negative strand RNA viruses in insects	31830128
PMC6902388	2019	9896	No Bull: A Case of Alpha-Gal Syndrome Associated With Buffalo Meat Sensitivity	31840005
PMC6974492	2019	57474	Maternal effect determines drought resistance of eggs in the predatory mite Phytoseiulus persimilis	31773312
PMC6926006	2019	68152	Metatranscriptomic reconstruction reveals RNA viruses with the potential to shape carbon cycling in soil	31772013
PMC6897422	2019	85283	Amblyomma americanum ticks utilizes countervailing pro and anti-inflammatory proteins to evade host defense	31756216
PMC6867850	2019	87576	Ehrlichia chaffeensis Outer Membrane Protein 1-Specific Human Antibody-Mediated Immunity Is Defined by Intracellular TRIM21-Dependent Innate Immune Activation and Extracellular Neutralization	31548319
PMC6900638	2019	61557	Vertical transmission in Caenorhabditis nematodes of RNA molecules encoding a viral RNA-dependent RNA polymerase	31740606
PMC6921050	2019	51422	Novel Insect Antifeedant and Ixodicidal Nootkatone Derivatives	31744055
PMC7123921	2019	361854	Infectious Diseases	
PMC6979106	2019	98867	Immunophenotypic characterization and clinical outcome in cats with lymphocytosis	31693230
PMC6867274	2019	153826	Predicted Northward Expansion of the Geographic Range of the Tick Vector Amblyomma americanum in North America under Future Climate Conditions	31670575
PMC6822432	2019	93886	In silico selection of functionally important proteins from the mialome of Ornithodoros erraticus ticks and assessment of their protective efficacy as vaccine targets	31666116
PMC6822344	2019	21458	Efficacy of sarolaner (Simparica(r)) against induced infestations of Haemaphysalis longicornis on dogs	31666109
PMC6821009	2019	49085	Regional biogeography of microbiota composition in the Chagas disease vector Rhodnius pallescens	31665056
PMC6913724	2019	88202	Usability and Feasibility of a Smartphone App to Assess Human Behavioral Factors Associated with Tick Exposure (The Tick App): Quantitative and Qualitative Study	31651409
PMC6955669	2019	50224	Line Immunoblot Assay for Tick-Borne Relapsing Fever and Findings in Patient Sera from Australia, Ukraine and the USA	31640151
PMC6835491	2019	15952	Advancing the Science of Tick and Tick-Borne Disease Surveillance in the United States	31635108
PMC6812269	2019	146193	Monitoring Silent Spillovers Before Emergence: A Pilot Study at the Tick/Human Interface in Thailand	31681195
PMC6988571	2019	102229	Evasion of autophagy mediated by Rickettsia surface protein OmpB is critical for virulence	31611642
PMC6798089	2019	78349	Comparative Tandem Mass Tag-Based Quantitative Proteomic Analysis of Tachaea chinensis Isopod During Parasitism	31681627
PMC6791345	2019	107395	Adapterama III: Quadruple-indexed, double/triple-enzyme RADseq libraries (2RAD/3RAD)	31616583
PMC6836180	2019	61203	Evaluation of NEON Data to Model Spatio-Temporal Tick Dynamics in Florida	31569729
PMC6836155	2019	22346	Detection of Rickettsiae, Borreliae, and Ehrlichiae in Ticks Collected from Walker County, Texas, 2017_2018	31557808
PMC6754170	2019	91393	Multi-scale patterns of tick occupancy and abundance across an agricultural landscape in southern Africa	31539412
PMC6963857	2019	62351	Immune Modulation and Immune-Mediated Pathogenesis of Emerging Tickborne Banyangviruses	31547199
PMC6789585	2019	32347	Tick Bites Induce Anti-alpha-Gal Antibodies in Dogs	31540167
PMC6780285	2019	37614	A Survey of Tick-Borne Bacterial Pathogens in Florida	31540253
PMC6743180	2019	107238	Tick mitochondrial genomes: structural characteristics and phylogenetic implications	31519208
PMC6737246	2019	124606	Polymicrobial Nature of Tick-Borne Diseases	31506314
PMC6733903	2019	71284	A transcriptome-based phylogenetic study of hard ticks (Ixodidae)	31501478
PMC6780246	2019	22142	Passive Animal Surveillance to Identify Ticks in Wisconsin, 2011_2017	31500362
PMC6730880	2019	95674	Habitat disturbance and the organization of bacterial communities in Neotropical hematophagous arthropods	31491005
PMC6728933	2019	27991	Immediate and persistent efficacy of sarolaner (Simparica(tm)) against Haemaphysalis elliptica on dogs	31488194
PMC6711231	2019	11550	Bourbon Virus in Wild and Domestic Animals, Missouri, USA, 2012_2013	31441752
PMC6724717	2019	54306	Differential Tick Salivary Protein Profiles and Human Immune Responses to Lone Star Ticks (Amblyomma americanum) From the Wild vs. a Laboratory Colony	31555263
PMC6784073	2019	29100	Hantaviridae: Current Classification and Future Perspectives	31461937
PMC6730956	2019	83979	Amblyomma americanum serpin 27 (AAS27) is a tick salivary anti-inflammatory protein secreted into the host during feeding	31449524
PMC6707551	2019	69719	Ticks home in on body heat: A new understanding of Haller's organ and repellent action	31442282
