pmcid	year	count	title	pubmedid
PMC7479100	2020	56237	Caffeine as a promotor of sexual development in sterile Queensland fruit fly males	
PMC7469186	2020	42899	Synergism between Hydramethylnon and Metarhizium anisopliae and Their Influence on the Gut Microbiome of Blattella germanica (L.)	32824260
PMC7469189	2020	32036	The Mayan Tropical Rainforest: An Uncharted Reservoir of Tritrophic Host-Fruit Fly-Parasitoid Interactions	32756345
PMC7391001	2020	168581	Pest categorisation of Haplaxius crudus	32742440
PMC7339632	2020	170128	Pest categorisation of Helicoverpa zea	32665793
PMC7339215	2020	183347	Pest categorisation of tomato leaf curl New Delhi virus	32665794
PMC7332975	2020	207870	Pest categorisation of the Andean Potato Weevil (<styled-content style="fixed-case" toggle="no">APW) complex (Coleoptera: Curculionidae)	32641976
PMC7448044	2020	161690	Pest categorisation of Ripersiella hibisci	32874345
PMC7348963	2020	44215	Modified Atmosphere Does Not Reduce the Efficacy of Phytosanitary Irradiation Doses Recommended for Tephritid Fruit Flies	32549285
PMC7283806	2020	116819	Wolbachia pipientis Associated With Tephritid Fruit Fly Pests: From Basic Research to Applications	32582067
PMC7349611	2020	39633	Evaluation of Drimys winteri (Canelo) Essential Oil as Insecticide against Acanthoscelides obtectus (Coleoptera: Bruchidae) and Aegorhinus superciliosus (Coleoptera: Curculionidae)	32486175
PMC7273966	2020	43189	Botanical Volatiles Selection in Mediating Electrophysiological Responses and Reproductive Behaviors for the Fall Webworm Moth Hyphantria cunea	32547409
PMC7290347	2020	66730	Host Plant and Antibiotic Effects on Scent Bouquet Composition of Anastrepha ludens and Anastrepha obliqua Calling Males, Two Polyphagous Tephritid Pests	32423147
PMC7290310	2020	54161	Pest Management and Ochratoxin A Contamination in Grapes: A Review	32392817
PMC7448086	2020	149700	Pest categorisation of Naupactus leucoloma	32874305
PMC7448047	2020	185123	Pest categorisation of Exomala orientalis	32874304
PMC7176680	2020	63696	Dispersal of female and male Aedes aegypti from discarded container habitats using a stable isotope mark-capture study design in South Texas	32321946
PMC7136004	2020	36738	Does Size Matter? Mate Choice in Two Lekking Flies	32277696
PMC7149484	2020	33142	Establishment of a Colony of Phlebotomus argentipes under Laboratory Conditions and Morphometric Variation between Wild-Caught and Laboratory-Reared Populations	
PMC7275689	2020	55426	Relative Tolerance of Three Morphotypes of the Anastrepha fraterculus Complex (Diptera: Tephritidae) to Cold Phytosanitary Treatment	32161970
PMC7447992	2020	209138	Pest categorisation of Liriomyza bryoniae	32874254
PMC7448051	2020	250160	Pest categorisation of Liriomyza sativae	32874253
PMC7448062	2020	201843	Pest categorisation of Nemorimyza maculosa	32874252
PMC7275692	2020	172458	Nonhost Status of Commercial Sweet Granadilla (Passiflora ligularis) in Peru to Ceratitis capitata (Diptera: Tephritidae) and Anastrepha fraterculus	32128582
PMC7044671	2020	34261	Effect of Density and Lethargy Duration in Prerelease Packaging of the Fruit Fly (Diptera: Tephritidae) Parasitoid, Diachasmimorpha longicaudata (Hymenoptera: Braconidae)	32104893
PMC7074471	2020	29712	Male-Produced (&#x2212;)-&#x3B4;-Heptalactone, Pheromone of Fruit Fly Rhagoletis batava (Diptera: Tephritidae), a Sea Buckthorn Berries Pest	32102198
PMC7073888	2020	67526	Agar and Carrageenan as Cost-Effective Gelling Agents in Yeast-Reduced Artificial Diets for Mass-Rearing Fruit Flies and Their Parasitoids	32085554
PMC7070424	2020	33667	An Opto-Electronic Sensor-Ring to Detect Arthropods of Significantly Different Body Sizes	32059444
PMC7074467	2020	45317	Life History and Host Preference of Trichopria drosophilae from Southern China, One of the Effective Pupal Parasitoids on the Drosophila Species	32033080
PMC6997409	2020	51392	Olive fruit volatiles route intraspecific interactions and chemotaxis in Bactrocera oleae (Rossi) (Diptera: Tephritidae) females	32015351
PMC6994132	2020	42284	Towards the implementation of a DNA barcode library for the identification of Peruvian species of Anastrepha (Diptera: Tephritidae)	32004351
PMC7008910	2020	395697	Pest categorisation of non-<styled-content style="fixed-case" toggle="no">EU viruses of Rubus L.	32626483
PMC7008913	2020	201955	Pest categorisation of Spodoptera eridania	32626486
PMC7008801	2020	118308	List of non-<styled-content style="fixed-case" toggle="no">EU phytoplasmas of Cydonia Mill., Fragaria L., Malus Mill., Prunus L., Pyrus L., Ribes L., Rubus L. and Vitis L.	32626485
PMC7008834	2020	528319	Pest categorisation of the non-<styled-content style="fixed-case" toggle="no">EU phytoplasmas of Cydonia Mill., Fragaria L., Malus Mill., Prunus L., Pyrus L., Ribes L., Rubus L. and Vitis L.	32626484
PMC6955104	2020	41615	Assessment of Bactrocera dorsalis (Diptera: Tephritidae) Diets on Adult Fecundity and Larval Development: Insights Into Employing the Sterile Insect Technique	31927595
PMC7008835	2020	433355	List of non-EU Scolytinae of coniferous hosts	32626487
PMC7008872	2020	220279	Pest categorisation of non-<styled-content style="fixed-case" toggle="no">EU Scolytinae of coniferous hosts	32626488
PMC6956792	2020	35564	Identifying model violations under the multispecies coalescent model using P2C2M.SNAPP	31949994
PMC7008906	2020	180927	Pest categorisation of potato virus X (non-<styled-content style="fixed-case" toggle="no">EU isolates)	32626491
PMC7008886	2020	112332	List of non-<styled-content style="fixed-case" toggle="no">EU viruses and viroids infecting potato (Solanum tuberosum) and other tuber-forming Solanum species	32626476
PMC7008841	2020	194753	Pest categorisation of potato virus S (non-<styled-content style="fixed-case" toggle="no">EU isolates)	32626479
PMC7008826	2020	198060	Pest categorisation of potato virus Y (non-<styled-content style="fixed-case" toggle="no">EU isolates)	32626492
PMC7008912	2020	171735	Pest categorisation of potato leafroll virus (non-<styled-content style="fixed-case" toggle="no">EU isolates)	32626493
PMC7008883	2020	688454	Pest categorisation of non-<styled-content style="fixed-case" toggle="no">EU viruses and viroids of potato	32626477
PMC7008853	2020	175301	Pest categorisation of potato virus A (non-<styled-content style="fixed-case" toggle="no">EU isolates)	32626489
PMC7008812	2020	168427	Pest categorisation of potato virus M (non-<styled-content style="fixed-case" toggle="no">EU isolates)	32626478
PMC7008781	2020	174564	Pest categorisation of potato virus V (non-<styled-content style="fixed-case" toggle="no">EU isolates)	32626490
PMC6938351	2019	39477	Irradiation dose response under hypoxia for the application of the sterile insect technique in Drosophila suzukii	31891597
PMC6929401	2019	75800	Gut bacterial diversity and physiological traits of Anastrepha fraterculus Brazilian-1 morphotype males are affected by antibiotic treatment	31870309
PMC6929328	2019	68519	Wolbachia infection in Argentinean populations of Anastrepha fraterculus sp1: preliminary evidence of sex ratio distortion by one of two strains	31870290
PMC6918546	2019	54335	Olive fruit fly rearing procedures affect the vertical transmission of the bacterial symbiont Candidatus Erwinia dacicola	31847839
PMC6893037	2019	54750	Symbionts do not affect the mating incompatibility between the Brazilian-1 and Peruvian morphotypes of the Anastrepha fraterculus cryptic species complex	31797888
PMC6955806	2019	38616	The Complete Mitochondrial Genome of Bactrocera carambolae (Diptera: Tephritidae): Genome Description and Phylogenetic Implications	31795125
PMC6874667	2019	57497	A conserved odorant binding protein is required for essential amino acid detection in Drosophila	31799428
PMC7008784	2019	277138	Pest categorisation of non-<styled-content style="fixed-case" toggle="no">EU viruses of Ribes L.	32626160
PMC6921064	2019	53945	What Can Integrated Analysis of Morphological and Genetic Data Still Reveal about the Anastrepha fraterculus (Diptera: Tephritidae) Cryptic Species Complex?	31731690
PMC7112054	2019	164686	Fly foregut and transmission of microbes	32287462
PMC7008829	2019	165133	Pest categorisation of Diabrotica virgifera zeae	32626159
PMC7008808	2019	152698	Pest categorisation of Diabrotica barberi	32626158
PMC7008942	2019	214892	Pest categorisation of non-<styled-content style="fixed-case" toggle="no">EU Acleris spp.	32626141
PMC6921062	2019	72406	Advances and Challenges of Using the Sterile Insect Technique for the Management of Pest Lepidoptera	31731445
PMC7234108	2020	44543	Sperm allocation strategies in a sperm heteromorphic insect	32440289
PMC7009187	2019	267766	List of non-EU viruses and viroids of Cydonia Mill., Fragaria L., Malus Mill., Prunus L., Pyrus L., Ribes L., Rubus L. and Vitis L.	32626418
PMC7009144	2019	489527	Pest categorisation of non-<styled-content style="fixed-case" toggle="no">EU viruses and viroids of Prunus L.	32626421
PMC7009087	2019	538074	Pest categorisation of non-<styled-content style="fixed-case" toggle="no">EU viruses and viroids of Vitis L.	32626420
PMC7009162	2019	369700	Pest categorisation of non-EU viruses of Fragaria L.	32626424
PMC7009133	2019	466957	Pest categorisation of non-<styled-content style="fixed-case" toggle="no">EU viruses and viroids of Cydonia Mill., Malus Mill. and Pyrus L.	32626419
PMC6754070	2019	99708	Putative Mitochondrial Sex Determination in the Bivalvia: Insights From a Hybrid Transcriptome Assembly in Freshwater Mussels	31572447
PMC6727639	2019	89385	Taxonomy, Diet, and Developmental Stage Contribute to the Structuring of Gut-Associated Bacterial Communities in Tephritid Pest Species	31555239
PMC6715623	2019	56951	Side effects of toxic bait formulations on Diachasmimorpha longicaudata (Hymenoptera: Braconidae)	31467411
PMC6693287	2019	50364	Candidates for chemosensory genes identified in the Chinese citrus fly, Bactrocera minax, through a transcriptomic analysis	31412763
PMC7009099	2019	255246	Pest categorisation of Spodoptera litura	32626379
PMC6722994	2019	21402	Using Gamma Irradiated Galleria mellonella L. and Plodia interpunctella (H&#xFC;bner) Larvae to Optimize Mass Rearing of Parasitoid Habrobracon hebetor (Say) (Hymenoptera: Braconidae)	31349741
PMC6723238	2019	38566	Oviposition Suitability of Drosophila Suzukii (Diptera: Drosophilidae) for Nectarine Varieties and Its Correlation with the Physiological Indexes	31344965
PMC6681355	2019	37101	Diachasmimorpha longicaudata Parasitism Response to Medfly Host Fruit and Fruit Infestation Age	31323827
PMC6630993	2019	62540	Structural Differences in the Digestive Tract Between Females and Males Could Modulate Regurgitation Behavior in Anastrepha ludens (Diptera: Tephritidae)	31309985
PMC7009215	2019	310906	Pest categorisation of non-<styled-content style="fixed-case" toggle="no">EU Cicadomorpha vectors of Xylella spp.	32626354
PMC6610499	2019	95100	The South American Fruit Fly: An Important Pest Insect With RNAi-Sensitive Larval Stages	31316391
PMC6579908	2019	33027	Transition-transversion mutations in the polyketide synthase gene of Aspergillus section Nigri	31338447
PMC6568381	2019	36416	Mate choice confers direct benefits to females of Anastrepha fraterculus (Diptera: Tephritidae)	31199808
PMC6627279	2019	29529	Unexpected Diversity of Wolbachia Associated with Bactrocera dorsalis (Diptera: Tephritidae) in Africa	31159272
PMC7009151	2019	131031	Pest categorisation of non-EU Choristoneura spp.	32626302
PMC7009245	2019	230664	Pest categorisation of non-<styled-content style="fixed-case" toggle="no">EU Margarodidae	32626291
PMC7009210	2019	147221	Pest categorisation of Clavibacter sepedonicus	32626290
PMC6468485	2019	63540	Physiological and Environmental Factors Affecting the Composition of the Ejaculate in Mosquitoes and Other Insects	30875967
PMC7009142	2019	203299	Pest categorisation of Phymatotrichopsis omnivora	32626246
PMC6427400	2019	81485	Development of an Optoelectronic Sensor for Detecting and Classifying Fruit Fly (Diptera: Tephritidae) for Use in Real-Time Intelligent Traps	30871087
PMC7009038	2019	255862	Pest categorisation of Thrips palmi	32626236
PMC7009242	2019	125724	Pest categorisation of Arrhenodes minutus	32626234
PMC7009226	2019	112246	Pest categorisation of Scaphoideus luteolus	32626233
PMC7009105	2019	161701	Pest categorisation of the Ralstonia solanacearum species complex	32626235
PMC6389545	2019	73971	Guava borer worm (Lepidoptera: Cossidae), a limiting pest in guava: biology, lifecycle and management alternatives	30886918
PMC6408394	2019	45460	When a male perceives a female: the effect of waxy components on the body surface on decision-making in the invasive pest weevil	30891277
PMC6493778	2019	87194	Interactions among morphotype, nutrition, and temperature impact fitness of an invasive fly	31061698
PMC6359877	2019	45960	Oviposition preference of Ceratitis capitata (Diptera: Tephritidae) at different times after pruning 'Italia' table grapes grown in Brazil	30715436
PMC7009243	2019	139736	Pest categorisation of Pseudopityophthorus minutissimus and P. pruinosus	32626065
PMC6312238	2018	79579	Can stable isotope markers be used to distinguish wild and mass-reared Anastrepha fraterculus flies?	30596760
PMC6301665	2018	70152	Genetic structure and diversity in Brazilian populations of Anastrepha obliqua (Diptera: Tephritidae)	30571687
PMC7009642	2018	172077	Pest categorisation of Gymnosporangium spp. (non-EU)	32625789
PMC7009431	2018	175590	Pest categorisation of Cronartium spp. (non-<styled-content style="fixed-case" toggle="no">EU)	32625788
PMC7009554	2018	156250	Pest categorisation of Grapholita inopinata	32625790
PMC7009751	2018	129668	Pest categorisation of Phyllosticta solitaria	32625787
PMC7009734	2018	155142	Pest categorisation of Grapholita prunivora	32625792
PMC7009653	2018	150571	Pest categorisation of Carposina sasakii	32625791
PMC7009355	2018	132264	Pest categorisation of Septoria malagutii	32625786
PMC6316256	2018	31593	Evaluation of Fruit Bagging as a Pest Management Option for Direct Pests of Apple	30513746
PMC6251160	2018	73777	Effect of antibiotic treatment and gamma-irradiation on cuticular hydrocarbon profiles and mate choice in tsetse flies (Glossina m. morsitans)	30470188
PMC6412167	2018	71353	Saving DNA from museum specimens: The success of DNA mini-barcodes in haplotype reconstruction in the genus Anastrepha (Diptera: Tephritidae)	30899595
PMC6315781	2018	75057	Field and Laboratory Studies on the Ecology, Reproduction, and Adult Diapause of the Asian Comma Butterfly, Polygonia c-aureum L. (Lepidoptera: Nymphalidae)	30469492
PMC6256065	2018	66140	Identification and Comparison of Chemosensory Genes in the Antennal Transcriptomes of Eucryptorrhynchus scrobiculatus and E. brandti Fed on Ailanthus altissima	30515106
PMC7009674	2018	335103	Pest categorisation of non-<styled-content style="fixed-case" toggle="no">EU Monochamus spp.	32625739
PMC7009705	2018	157173	Pest categorisation of Popillia japonica	32625740
PMC6211715	2018	59490	One for all: Mating compatibility among various populations of olive fruit fly (Diptera: Tephritidae) for application of the sterile insect technique	30383856
PMC7009690	2018	126501	Pest categorisation of Acrobasis pirivorella	32625719
PMC7009433	2018	201648	Pest categorisation of Conotrachelus nenuphar	32625717
PMC7009462	2018	186028	Pest categorisation of Aleurocanthus spp.	32625716
PMC7009599	2018	150044	Pest categorisation of Sternochetus mangiferae	32625718
PMC7009569	2018	148825	Pest categorisation of Stagonosporopsis andigena	32625720
PMC7009533	2018	150483	Pest categorisation of Thecaphora solani	32625724
PMC7009392	2018	98368	Pest categorisation of Melampsora farlowii	32625721
PMC7009403	2018	126452	Pest categorisation of Cronartium harknessii, Cronartium kurilense and Cronartium sahoanum	32625722
PMC6139333	2018	163549	Evidence for Introgression Among Three Species of the Anastrepha fraterculus Group, a Radiating Species Complex of Fruit Flies	30250479
PMC6105101	2018	38692	Genetic Characterization of Some Neoponera (Hymenoptera: Formicidae) Populations Within the foetida Species Complex	30137374
PMC6105096	2018	63620	Spinosad Versus Spinetoram Effects on Kill and Oviposition of Rhagoletis indifferens (Diptera: Tephritidae) at Differing Fly Ages and Temperatures	30137375
PMC7009476	2018	155257	Pest categorisation of Lopholeucaspis japonica	32625986
PMC7009610	2018	125088	Pest categorisation of Arceuthobium spp. (non-<styled-content style="fixed-case" toggle="no">EU)	32626005
PMC7009507	2018	354447	Updated pest categorisation of Xylella fastidiosa	32625990
PMC7009611	2018	216001	Pest categorisation of Synchytrium endobioticum	32625985
PMC6054417	2018	97590	Optimization of the sterilizing doses and overflooding ratios for the South American fruit fly	30028883
PMC7009427	2018	132529	Pest categorisation of Melampsora medusae	32625987
PMC7009623	2018	168041	Pest categorisation of Pantoea stewartii subsp. stewartii	32625989
PMC7009435	2018	227072	Pest categorisation of Xiphinema americanum sensu lato	32625952
PMC7009758	2018	93310	Pest categorisation of Chrysomyxa arctostaphyli	32625988
PMC6073409	2018	60826	Biological Activities and Safety of Citrus spp. Essential Oils	29976894
PMC7009524	2018	174009	Pest categorisation of Grapholita packardi	32625941
PMC7009379	2018	134940	Pest categorisation of Dendrolimus sibiricus	32625938
PMC7009539	2018	163879	Pest categorisation of non-<styled-content style="fixed-case" toggle="no">EU Pissodes spp.	32625937
PMC7009747	2018	199225	Pest categorisation of Hirschmanniella spp.	32625936
PMC7009694	2018	109836	Pest categorisation of Coniferiporia sulphurascens and Coniferiporia weirii	32625939
PMC7009706	2018	147368	Pest categorisation of Colletotrichum gossypii	32625942
PMC7009573	2018	107954	Pest categorisation of Guignardia laricina	32625940
PMC7009624	2018	112516	Pest categorisation of Curtobacterium flaccumfaciens pv. flaccumfaciens	32625922
PMC6007453	2018	108955	Sexual Selection on Leks: A Fruit Fly Primer	29850851
PMC7009568	2018	145069	Pest categorisation of Apiosporina morbosa	32625876
PMC7009501	2018	142715	Pest categorisation of Anthonomus quadrigibbus	32625877
PMC7009736	2018	172299	Pest categorisation of Nacobbus aberrans	32625881
PMC7009452	2018	117190	Pest categorisation of Sphaerulina musiva	32625879
PMC7009735	2018	107013	Pest categorisation of Mycodiella laricis-leptolepidis	32625878
PMC7009572	2018	128163	Pest categorisation of 'Blight and blight-like' diseases of citrus	32625880
PMC5888387	2018	42196	Best Host Age of Anastrepha obliqua (Diptera: Tephritidae) for Multiplication of Four Native Parasitoids from the Americas	29718497
PMC5854383	2018	51795	Chromatin immunoprecipitation (ChIP) method for non-model fruit flies (Diptera: Tephritidae) and evidence of histone modifications	29543899
PMC7009473	2018	118950	Pest categorisation of Fusarium oxysporum f. sp. albedinis	32625825
PMC5969315	2018	103228	From laboratory to point of entry: development and implementation of a loop-mediated isothermal amplification (LAMP)-based genetic identification system to prevent introduction of quarantine insect species	29363271
PMC7009559	2018	188868	Pest categorisation of Unaspis citri	32625826
PMC7009695	2018	148324	Pest categorisation of Scirtothrips citri	32625828
PMC7009615	2018	120932	Pest categorisation of Scirtothrips aurantii	32625827
PMC7009752	2018	82851	Pest categorisation of Aschistonyx eppoi	32625819
PMC7009401	2018	133489	Pest categorisation of Bretziella fagacearum	32625818
PMC7009558	2018	97568	Pest categorisation of Anisogramma anomala	32625817
PMC5794786	2018	30120	A conserved motif within cox 2 allows broad detection of economically important fruit flies (Diptera: Tephritidae)	29391551
PMC6601130	2019	51252	Insecticidal effects of Vernonanthura nebularum against two economically important pest insects	31303815
PMC7009585	2018	168395	Pest categorisation of the Gonipterus scutellatus species complex	32625663
PMC7009430	2018	135438	Pest categorisation of Tecia solanivora	32625661
PMC7009692	2018	135337	Pest categorisation of Xanthomonas oryzae pathovars oryzae and oryzicola	32625664
PMC5786236	2018	83622	Evidence of Adaptive Evolution and Relaxed Constraints in Sex-Biased Genes of South American and West Indies Fruit Flies (Diptera: Tephritidae)	29346618
PMC7009757	2018	120546	Pest categorisation of Toxoptera citricida	32625662
PMC7009549	2018	127550	Pest categorisation of Listronotus bonariensis	32625660
PMC5744943	2017	96932	Phylogeography and population diversity of Simulium hirtipupa Lutz (Diptera: Simuliidae) based on mitochondrial COI sequences	29281704
PMC5943938	2017	37510	Molecular Targets for Components of Essential Oils in the Insect Nervous System-A Review	29295521
PMC7010112	2017	163012	Pest categorisation of Elsino&#xEB; fawcettii and E. australis	32625385
PMC7009986	2017	163771	Pest categorisation of small-spored Alternaria carrying the genes for the <styled-content style="fixed-case" toggle="no">AM- or <styled-content style="fixed-case" toggle="no">AK-toxin biosynthesis	32625384
PMC7010167	2017	117486	Pest categorisation of Cephalcia lariciphila	32625388
PMC7010073	2017	95952	Pest categorisation of Stegophora ulmea	32625387
PMC7009948	2017	122760	Pest categorisation of Davidsoniella virescens	32625386
PMC5735174	2017	77098	Functional characterization of the circadian clock in the Antarctic krill, Euphausia superba	29255161
PMC7010191	2017	106196	Pest categorisation of Longidorus diadecturus	32625392
PMC7009903	2017	111691	Pest categorisation of Xiphinema californicum	32625391
PMC7009891	2017	123828	Pest categorisation of Gilpinia hercyniae	32625389
PMC7009949	2017	197479	Pest categorisation of Citrus leprosis viruses	32625390
PMC7010136	2017	113545	Pest categorisation of Anthonomus grandis	32625370
PMC7010206	2017	120214	Pest categorisation of Anthonomus bisignifer	32625369
PMC5720772	2017	66355	Complete mitochondrial genome of Zeugodacus tau (Insecta: Tephritidae) and differentiation of Z. tau species complex by mitochondrial cytochrome c oxidase subunit I gene	29216281
PMC5719964	2017	92492	Molecular evolution of virulence genes and non-virulence genes in clinical, natural and artificial environmental Legionella pneumophila isolates	29226035
PMC7009885	2017	118815	Pest categorisation of naturally-spreading psorosis	32625361
PMC5709374	2017	47714	The mitochondrial genome of the wolfberry fruit fly, Neoceratitis asiatica (Becker) (Diptera: Tephritidae) and the phylogeny of Neoceratitis Hendel genus	29192255
PMC7010118	2017	154864	Pest categorisation of Botryosphaeria kuwatsukai	32625337
PMC7010166	2017	96769	Pest categorisation of Oligonychus perditus	32625360
PMC7009827	2017	114608	Pest categorisation of Venturia nashicola	32625336
PMC7010017	2017	131261	Pest categorisation of Puccinia pittieriana	32625338
PMC5713417	2017	80909	New Insights into the Microbiota of Moth Pests	29156569
PMC5681579	2017	77429	Current source density mapping of antennal sensory selectivity reveals conserved olfactory systems between tephritids and Drosophila	29127313
PMC7010058	2017	140596	Pest categorisation of Gremmeniella abietina	32625335
PMC7009978	2017	133044	Pest categorisation of Pseudocercospora pini-densiflorae	32625334
PMC7009832	2017	123508	Pest categorisation of Ips cembrae	32625339
PMC7010174	2017	127906	Pest categorisation of Ips sexdentatus	32625327
PMC7010111	2017	110611	Pest categorisation of Satsuma dwarf virus	32625319
PMC7009941	2017	120480	Pest categorisation of Ips duplicatus	32625323
PMC7009860	2017	107812	Pest categorisation of Witches' broom disease of lime (Citrus aurantifolia) phytoplasma	32625316
PMC7009808	2017	138458	Pest categorisation of Citrus tristeza virus (non-European isolates)	32625318
PMC7010183	2017	121666	Pest categorisation of Ips amitinus	32625322
PMC7009989	2017	136660	Pest categorisation of Palm lethal yellowing phytoplasmas	32625317
PMC7009904	2017	115248	Pest categorisation of Tatter leaf virus	32625320
PMC7009923	2017	186048	Pest categorisation of Hishimonus phycitis	32625321
PMC5696426	2017	73617	Effects of macronutrient intake on the lifespan and fecundity of the marula fruit fly, Ceratitis cosyra (Tephritidae): Extreme lifespan in a host specialist	29188010
PMC7010050	2017	132482	Pest categorisation of Beet curly top virus (non-<styled-content style="fixed-case" toggle="no">EU isolates)	32625295
PMC5619704	2017	43559	The sterile insect technique for the management of the spotted wing drosophila, Drosophila suzukii: Establishing the optimum irradiation dose	28957331
PMC5597691	2017	48479	Evolutionary coincidence of adaptive changes in exuperantia and the emergence of bicoid in Cyclorrhapha (Diptera)	28894941
PMC5584755	2017	48555	Epicuticular chemistry reinforces the new taxonomic classification of the Bactrocera dorsalis species complex (Diptera: Tephritidae, Dacinae)	28873446
PMC5569085	2017	53933	Identification of an insect-produced olfactory cue that primes plant defenses	28835618
PMC7010051	2017	131853	Pest categorisation of Pseudocercospora angolensis	32625548
PMC7009821	2017	120588	Pest categorisation of Entoleuca mammata	32625581
PMC7009806	2017	158695	Pest categorisation of Little cherry pathogen (non-<styled-content style="fixed-case" toggle="no">EU isolates)	32625582
PMC7010175	2017	119561	Pest categorisation of Cadang-Cadang viroid	32625584
PMC5501848	2017	69982	The chromosomes and the mitogenome of Ceratitis fasciventris (Diptera: Tephritidae): two genetic approaches towards the Ceratitis FAR species complex resolution	28687799
PMC7009900	2017	113182	Pest categorisation of Ips typographus	32625546
PMC7009894	2017	204480	Pest categorisation of Spodoptera frugiperda	32625583
PMC7010210	2017	125505	Pest categorisation of Anthonomus signatus	32625547
PMC7009980	2017	117162	Pest categorisation of Dendroctonus micans	32625545
