pmcid	year	count	title	pubmedid
PMC7487574	2020	80441	Sequence diversity of cytotoxic T cell antigens and satellite marker analysis of Theileria parva informs the immunization against East Coast fever in Rwanda	32894166
PMC7458302	2020	67876	Pathogens, endosymbionts, and blood-meal sources of host-seeking ticks in the fast-changing Maasai Mara wildlife ecosystem	32866142
PMC7453536	2020	55423	Molecular evidence confirms occurrence of Rhipicephalus microplus Clade A in Kenya and sub-Saharan Africa	32854747
PMC7474386	2020	49651	Comparison of Tick Control and Antibiotic Use Practices at Farm Level in Regions of High and Low Acaricide Resistance in Uganda	32908661
PMC7448653	2020	34212	Evaluation of Serological Tests for Detection of Antibodies against Lumpy Skin Disease Virus	32434783
PMC7428492	2020	78553	Differential localization of Hessian fly candidate effectors in resistant and susceptible wheat plants	32818166
PMC7417564	2020	52824	Karyotype changes in long-term cultured tick cell lines	32778731
PMC7412822	2020	27481	Evaluation of different storage times and preservation methods on phlebotomine sand fly DNA concentration and purity	32762709
PMC7459594	2020	38614	Rickettsia africae an Agent of African Tick Bite Fever in Ticks Collected from Domestic Animals in Eastern Cape, South Africa	32748891
PMC7469192	2020	52108	Plant-Derived Natural Compounds for Tick Pest Control in Livestock and Wildlife: Pragmatism or Utopia?	32752256
PMC7456782	2020	46129	Inferences about the transmission of lumpy skin disease virus between herds from outbreaks in Albania in 2016	30581093
PMC7393499	2020	151926	A transcriptome and proteome of the tick Rhipicephalus microplus shaped by the genetic composition of its hosts and developmental stage	32732984
PMC7429393	2020	121588	Low genetic diversity among Francisella-like endosymbionts within different genotypes of Hyalomma dromedarii ticks infesting camels in Saudi Arabia	32848325
PMC7396615	2020	97581	TickSialoFam (TSFam): A Database That Helps to Classify Tick Salivary Proteins, a Review on Tick Salivary Protein Function and Evolution, With Considerations on the Tick Sialome Switching Phenomenon	32850476
PMC7387652	2020	66035	Nairobi Sheep Disease Virus: A Historical and Epidemiological Perspective	32793646
PMC7378379	2020	112678	Discovery of Exosomes From Tick Saliva and Salivary Glands Reveals Therapeutic Roles for CXCL12 and IL-8 in Wound Healing at the Tick_Human Skin Interface	32766239
PMC7433224	2020	75487	Parasites of veterinary importance from domestic animals in uMkhanyakude district of KwaZulu-Natal province	32787418
PMC7284302	2020	18948	Identification and validation of internal reference genes for real-time quantitative polymerase chain reaction-based studies in Hyalomma anatolicum ticks	32222359
PMC7323972	2020	95551	Analysis of p67 allelic sequences reveals a subtype of allele type 1 unique to buffalo-derived Theileria parva parasites from southern Africa	32598384
PMC7306492	2020	23071	Genetic diversity of the ATAQ gene in Rhipicephalus microplus collected in Mexico and implications as anti-tick vaccine	32572573
PMC7346153	2020	68383	Edible Leafy Plants from Mexico as Sources of Antioxidant Compounds, and Their Nutritional, Nutraceutical and Antimicrobial Potential: A Review	32575671
PMC7396350	2020	51248	The effect of Beauveria bassiana inoculation on plant growth, volatile constituents, and tick (Rhipicephalus appendiculatus) repellency of acetone extracts of Tulbaghia violacea	32801568
PMC7350222	2020	43070	Vaccination with Recombinant Subolesin Antigens Provides Cross-Tick Species Protection in Bos indicus and Crossbred Cattle in Uganda	32570925
PMC7355616	2020	37407	Interrupted Blood Feeding in Ticks: Causes and Consequences	32560202
PMC7296661	2020	85129	Catalogue of stage-specific transcripts in Ixodes ricinus and their potential functions during the tick life-cycle	32546252
PMC7366568	2020	32461	Morphological and molecular identification of ixodid tick species (Acari: Ixodidae) infesting cattle in Uganda	32533261
PMC7297041	2020	94981	Understanding Tick Biology and Its Implications in Anti-tick and Transmission Blocking Vaccines Against Tick-Borne Pathogens	32582785
PMC7296165	2020	135147	Comparative Transcriptomics of the Bovine Apicomplexan Parasite Theileria parva Developmental Stages Reveals Massive Gene Expression Variation and Potential Vaccine Antigens	32582776
PMC7275347	2020	47689	Initiator and executioner caspases in salivary gland apoptosis of Rhipicephalus haemaphysaloides	32503655
PMC7308261	2020	14492	The Rhipicephalus appendiculatus tick vector of Theileria parva is absent from cape buffalo (Syncerus caffer) populations and associated ecosystems in northern Uganda	32500369
PMC7274042	2020	100477	Risk Factors for Outbreaks of Lumpy Skin Disease and the Economic Impact in Cattle Farms of Nakuru County, Kenya	32548130
PMC7225584	2020	55799	Poor Unstable Midgut Microbiome of Hard Ticks Contrasts With Abundant and Stable Monospecific Microbiome in Ovaries	32457850
PMC7214809	2020	57813	Seroprevalence of Selected Tick Borne Pathogens and Diversity and Abundance of Ixodid Ticks (Acari: Ixodidae) at the Wildlife-Livestock Interface in Northern Botswana	32432129
PMC7198617	2020	45722	Non-vector-borne transmission of lumpy skin disease virus	32366872
PMC7294229	2020	62344	Theileria parva: a parasite of African buffalo, which has adapted to infect and undergo transmission in cattle	32032592
PMC7281522	2020	44241	Genetic Diversity and Sequence Polymorphism of Two Genes Encoding Theileria parva Antigens Recognized by CD8+ T Cells among Vaccinated and Unvaccinated Cattle in Malawi	32365795
PMC7171862	2020	57595	Amblyomma hebraeum is the predominant tick species on goats in the Mnisi Community Area of Mpumalanga Province South Africa and is co-infected with Ehrlichia ruminantium and Rickettsia africae	32312285
PMC7171786	2020	46097	Don't let sleeping dogs lie: unravelling the identity and taxonomy of Babesia canis, Babesia rossi and Babesia vogeli	32312292
PMC7225381	2020	57482	Ectoparasitism during an avian disease outbreak: An experiment with Mycoplasma-infected house finches and ticks	32426219
PMC7238268	2020	30826	Characterization of an MLP Homologue from Haemaphysalis longicornis (Acari: Ixodidae) Ticks	32295244
PMC7138852	2020	45841	Liquid water intake of the lone star tick, Amblyomma americanum: Implications for tick survival and management	32265527
PMC7118885	2020	25717	Invasive cattle ticks in East Africa: morphological and molecular confirmation of the presence of Rhipicephalus microplus in south-eastern Uganda	32245511
PMC7101105	2020	30222	Crimean-Congo Hemorrhagic Fever Virus in Humans and Livestock, Pakistan, 2015_2017	32187506
PMC7114739	2020	41580	Expression analysis of glutathione S-transferases and ferritins during the embryogenesis of the tick Haemaphysalis longicornis	32258487
PMC7177830	2020	17592	Epidemiological Study of Thogoto and Dhori Virus Infection in People Bitten by Ticks, and in Sheep, in an Area of Northern Spain	32230796
PMC7216920	2020	79911	First detection of Theileria parva in cattle from Cameroon in the absence of the main tick vector Rhipicephalus appendiculatus	32174039
PMC7143779	2020	26507	Mechanical Transmission of Lumpy Skin Disease Virus by Stomoxys spp. (Stomoxys calsitrans, Stomoxys sitiens, Stomoxys indica), Diptera: Muscidae	32178349
PMC7143654	2020	51289	Management Options for Ixodes ricinus-Associated Pathogens: A Review of Prevention Strategies	32178257
PMC7076983	2020	70843	Ovary Proteome Analysis Reveals RH36 Regulates Reproduction via Vitellin Uptake Mediated by HSP70 Protein in Hard Ticks	32211346
PMC7052283	2020	40251	Tick Cell Lines in Research on Tick Control	32158404
PMC7157752	2020	62971	Quantitative Proteomics Identifies Metabolic Pathways Affected by Babesia Infection and Blood Feeding in the Sialoproteome of the Vector Rhipicephalus bursa	32092882
PMC7041427	2020	139621	Tick-Borne Encephalitis Virus Infection Alters the Sialome of Ixodes ricinus Ticks During the Earliest Stages of Feeding	32133301
PMC7049414	2020	34001	In Vitro Acaricidal Activity of Selected Medicinal Plants Traditionally Used against Ticks in Eastern Ethiopia	32148933
PMC7142041	2020	69791	Olfactory Receptor Neurons for Plant Volatiles and Pheromone Compounds in the Lucerne Weevil, Sitona discoideus	32048118
PMC7041860	2020	209995	Time-resolved proteomic profile of Amblyomma americanum tick saliva during feeding	32049966
PMC7458381	2020	41618	Exposure to ambient air causes degradation and decreased in vitro potency of buparvaquone and parvaquone	32904749
PMC7077237	2020	52988	RNA Viruses of Amblyomma variegatum and Rhipicephalus microplus and Cattle Susceptibility in the French Antilles	31991915
PMC7074330	2020	34967	Terpenoid-Induced Feeding Deterrence and Antennal Response of Honey Bees	31979399
PMC7010998	2020	39415	Investigations into the carrier-state of Theileria sp. (buffalo) in cattle	32071860
PMC6985549	2020	97967	Gene Expression in the Salivary Gland of Rhipicephalus (Boophilus) microplus Fed on Tick-Susceptible and Tick-Resistant Hosts	32039052
PMC6965182	2020	46640	Quantitative analysis of Anaplasma marginale acquisition and transmission by Dermacentor andersoni fed in vitro	31949241
PMC6961398	2020	48165	Comparative vector competence of North American Lyme disease vectors	31937369
PMC6934832	2019	41524	Experimental evidence of mechanical lumpy skin disease virus transmission by Stomoxys calcitrans biting flies and Haematopota spp. horseflies	31882819
PMC7458380	2019	47288	Haemaphysalis longicornis: the life-cycle on dogs and cattle, with confirmation of its vector status for Theileria orientalis in Australia	32904744
PMC7041997	2019	23242	FTA-Sodium hydroxide-based polymerase chain reaction (PCR): An efficient andcheaper option for Theileria parva detection in dairy cattle in Mbarara,Uganda	31875599
PMC6955305	2020	64621	An inhibitor of complement C5 provides structural insights into activation	31871188
PMC6915983	2019	96958	Genetic and antigenic variation of the bovine tick-borne pathogen Theileria parva in the Great Lakes region of Central Africa	31842995
PMC6963982	2019	24985	Phytochemical Analysis of Tephrosia vogelii across East Africa Reveals Three Chemotypes that Influence Its Use as a Pesticidal Plant	31842487
PMC6894798	2019	55669	Molecular identification of Ehrlichia, Anaplasma, Babesia and Theileria in African elephants and their ticks	31805127
PMC6897422	2019	85283	Amblyomma americanum ticks utilizes countervailing pro and anti-inflammatory proteins to evade host defense	31756216
PMC6852549	2019	47236	Ixodid ticks (Acari: Ixodidae) collected from African savanna elephants (Loxodonta africana) and African forest elephants (Loxodonta cyclotis)	31714141
PMC6921006	2019	34005	Isolation and Characterization of a Novel Pathogenic Strain of Ehrlichia minasensis	31694172
PMC6963272	2019	22668	Towards a Multidisciplinary Approach to Improve Cattle Health and Production in Uganda	31683596
PMC6868261	2019	22326	Preliminary investigation of acaricidal activity of leaf extract of Nicotiana tabacum on dog tick Rhipicephalus sanguineus	31849425
PMC6882721	2019	27015	Prevalence and climatic influence on hemoparasites of cattle and sheep in Mosul, Iraq	31819877
PMC6963187	2019	86560	The Immunomodulatory Effect of IrSPI, a Tick Salivary Gland Serine Protease Inhibitor Involved in Ixodes ricinus Tick Feeding	31614804
PMC6775757	2019	56995	Identification of Ixodid Tick-Specific Aquaporin-1 Potential Anti-tick Vaccine Epitopes: An in-silico Analysis	31612130
PMC7149732	2020	93337	Vaccines the tugboat for prevention-based animal production	
PMC6754170	2019	91393	Multi-scale patterns of tick occupancy and abundance across an agricultural landscape in southern Africa	31539412
PMC6737592	2019	68015	Molecular identification and prevalence of tick-borne pathogens in zebu and taurine cattle in North Cameroon	31511038
PMC6789608	2019	47089	Diagnostic Tools for the Identification of Babesia sp. in Persistently Infected Cattle	31505741
PMC6733903	2019	71284	A transcriptome-based phylogenetic study of hard ticks (Ixodidae)	31501478
PMC6813609	2019	23912	Correlation between hematological profile and theileriosis in Bali cattle from Muara Bulian, Jambi, Indonesia	31749567
PMC6712667	2019	44288	Proteomic informed by transcriptomic for salivary glands components of the camel tick Hyalomma dromedarii	31455241
PMC6717101	2019	54815	Exposure of dogs to Rickettsia spp. in Costa Rica: Risk factors for PCR-positive ectoparasites and seropositivity	31489383
PMC6706653	2019	36018	Cryptic species diversity in ticks that transmit disease in Australia	31463190
PMC6684781	2019	70462	TOR as a Regulatory Target in Rhipicephalus microplus Embryogenesis	31417424
PMC6657053	2019	35217	A combination of antibodies against Bm86 and Subolesin inhibits engorgement of Rhipicephalus australis (formerly Rhipicephalus microplus) larvae in vitro	31345265
PMC6676935	2019	74288	Acaricidal activity of the aqueous and hydroethanolic extracts of 15 South African plants against Rhipicephalus turanicus and their toxicity on human liver and kidney cells	31368326
PMC6626424	2019	50764	Genetic diversity of Bm86 sequences in Rhipicephalus (Boophilus) microplus ticks from Mexico: analysis of haplotype distribution patterns	31299900
PMC6624921	2019	50148	Immunomodulatory effects of Rhipicephalus haemaphysaloides serpin RHS2 on host immune responses	31296257
PMC6615106	2019	39433	Seroprevalence and risk factors for lumpy skin disease virus seropositivity in cattle in Uganda	31286926
PMC6617849	2019	120583	Deciphering Biological Processes at the Tick-Host Interface Opens New Strategies for Treatment of Human Diseases	31333488
PMC6607933	2019	32471	The Use of Tick Salivary Proteins as Novel Therapeutics	31297067
PMC6593522	2019	39455	Characterization of an iron-inducible Haemaphysalis longicornis tick-derived promoter in an Ixodes scapularis-derived tick cell line (ISE6)	31238993
PMC6591964	2019	52902	Comparative proteomics of the vector Dermacentor reticulatus revealed differentially regulated proteins associated with pathogen transmission in response to laboratory infection with Rickettsia slovaca	31234913
PMC6591454	2019	53724	Repurposing of Glycine-Rich Proteins in Abiotic and Biotic Stresses in the Lone-Star Tick (Amblyomma americanum)	31275163
PMC6556756	2019	22671	Comparative microbiomes of ticks collected from a black rhino and its surrounding environment	31198683
PMC6536706	2019	45748	Dynamics of Insulin Signaling in the Black-Legged Tick, Ixodes scapularis	31164865
PMC6537121	2019	50948	Vitellogenin Receptor as a Target for Tick Control: A Mini-Review	31178755
PMC6524299	2019	59373	Aedes aegypti saliva impairs M1-associated proinflammatory phenotype without promoting or affecting M2 polarization of murine macrophages	31097013
PMC6767157	2019	81278	Using the basic reproduction number to assess the risk of transmission of lumpy skin disease virus by biting insects	31038286
PMC6518728	2019	92396	Counterattacking the tick bite: towards a rational design of anti-tick vaccines targeting pathogen transmission	31088506
PMC6501394	2019	43636	Intracellular localization of vitellogenin receptor mRNA and protein during oogenesis of a parthenogenetic tick, Haemaphysalis longicornis	31060579
PMC6497691	2019	59708	Ultrastructural mapping of salivary gland innervation in the tick Ixodes ricinus	31048723
PMC6504839	2019	172104	Chemical Equilibrium at the Tick_Host Feeding Interface:A Critical Examination of Biological Relevance in Hematophagous Behavior	31118903
PMC6492539	2019	179811	Benzoylphenyl ureas as veterinary antiparasitics. An overview and outlook with emphasis on efficacy, usage and resistance	31041897
PMC6501543	2019	59676	Molecular and Antigenic Properties of Mammalian Cell-Expressed Theileria parva Antigen Tp9	31110506
PMC6487012	2019	37272	Repellent properties of Rotheca glabrum plant extracts against adults of Rhipicephalus appendiculatus	31029169
PMC6557783	2019	46243	Emergence of human infection with Jingmen tick virus in China: A retrospective study	31003930
PMC6454348	2019	97622	Transcriptome and Proteome Response of Rhipicephalus annulatus Tick Vector to Babesia bigemina Infection	31001128
PMC6446187	2019	77883	Isolation of known and potentially pathogenic tick-borne microorganisms from European ixodid ticks using tick cell lines	30819609
PMC6446184	2019	56805	A countrywide molecular survey leads to a seminal identification of the invasive cattle tick Rhipicephalus (Boophilus) microplus in Cameroon, a decade after it was reported in Cote d'Ivoire	30765191
PMC6643011	2019	15704	Identification of Theileria Species in Sheep and Vector Ticks Using PCR Method in Zabol, Eastern Iran	31346537
PMC6411927	2019	43873	Gene gun DNA immunization of cattle induces humoral and CD4 T-cell-mediated immune responses against the Theileria parva polymorphic immunodominant molecule	30782490
PMC6408786	2019	84940	Vitellogenins in the spider Parasteatoda tepidariorum _ expression profile and putative hormonal regulation of vitellogenesis	30849941
PMC6404298	2019	39150	Humoral immune response to repeated lumpy skin disease virus vaccination and performance of serological tests	30841894
PMC6375067	2019	75491	Prostaglandins and Other Eicosanoids in Insects: Biosynthesis and Biological Actions	30792667
PMC6366118	2019	33850	Molecular detection of Anaplasma infections in ixodid ticks from the Qinghai-Tibet Plateau	30728069
PMC6369204	2019	62709	Amblyomma sculptum Salivary PGE2 Modulates the Dendritic Cell-Rickettsia rickettsii Interactions in vitro and in vivo	30778355
PMC6355982	2019	72839	Dissecting Flavivirus Biology in Salivary Gland Cultures from Fed and Unfed Ixodes scapularis (Black-Legged Tick)	30696737
PMC6345952	2019	35080	Novel pseudo-aspartic peptidase from the midgut of the tick Rhipicephalus microplus	30679545
PMC6409542	2019	39103	New Viruses from the Ectoparasite Mite Varroa destructor Infesting Apis mellifera and Apis cerana	30678330
PMC6351451	2019	64169	Arbovirus-Mosquito Vector-Host Interactions and the Impact on Transmission and Disease Pathogenesis of Arboviruses	30728812
PMC6466432	2019	55635	Time to Micromanage the Pathogen-Host-Vector Interface: Considerations for Vaccine Development	30669682
PMC6340049	2019	75791	Extensive Diversity of RNA Viruses in Australian Ticks	30404810
PMC6321724	2019	27522	Silencing expression of the Rhipicephalus microplus vitellogenin receptor gene blocks Babesia bovis transmission and interferes with oocyte maturation	30611310
PMC6442324	2019	89827	Cytotoxic Effects of Extract of Acmella oleracea in the Ovaries and Midgut of Rhipicephalus sanguineus Latreille, 1806 (Acari: Ixodidae) Female Ticks	31008054
PMC6293010	2018	34608	Crucial Role for Basophils in Acquired Protective Immunity to Tick Infestation	30581391
PMC6290058	2018	60160	Preliminary Evaluation of Tick Protein Extracts and Recombinant Ferritin 2 as Anti-tick Vaccines Targeting Ixodes ricinus in Cattle	30568595
PMC6288443	2018	30813	A Continuing Exploration of Tick_Virus Interactions Using Various Experimental Viral Infections of Hard Ticks	30564140
PMC6264878	2018	38161	Evaluating the effects of anticoagulants on Rhodnius prolixus artificial blood feeding	30496298
PMC6236881	2018	136326	A bite so sweet: the glycobiology interface of tick-host-pathogen interactions	30428923
PMC6277881	2018	66109	Functional Evolution of Subolesin/Akirin	30542290
PMC6278309	2018	103934	Tagetes spp. Essential Oils and Other Extracts: Chemical Characterization and Biological Activity	30388858
PMC7150131	2018	171894	Suidae and Tayassuidae	
PMC7009741	2018	223623	Lumpy skin disease: scientific and technical assistance on control and surveillance activities	32625728
PMC6197074	2018	84420	Immuno-informatics Analysis to Identify Novel Vaccine Candidates and Design of a Multi-Epitope Based Vaccine Candidate Against Theileria parasites	30374343
PMC6179218	2018	74533	Transcriptomics reveal potential vaccine antigens and a drastic increase of upregulated genes during Theileria parva development from arthropod to bovine infective stages	30303978
PMC6175517	2018	125479	Reference genes selection for quantitative gene expression studies in tea green leafhoppers, Empoasca onukii Matsuda	30296272
PMC6177531	2018	129264	Combining Landscape Genomics and Ecological Modelling to Investigate Local Adaptation of Indigenous Ugandan Cattle to East Coast Fever	30333851
PMC6158917	2018	112099	Transcriptomic analysis of crustacean neuropeptide signaling during the moult cycle in the green shore crab, Carcinus maenas	30257651
PMC6112642	2018	117109	Large mammal declines and the incipient loss of mammal-bird mutualisms in an African savanna ecosystem	30153277
PMC6109354	2018	49988	Identification of a putative methyltransferase gene of Babesia bigemina as a novel molecular biomarker uniquely expressed in parasite tick stages	30143025
PMC6102388	2018	52571	Sensitivity of Entomopathogenic Fungi and Bacteria to Plants Secondary Metabolites, for an Alternative Control of Rhipicephalus (Boophilus) microplus in Cattle	30154722
PMC6091150	2018	73763	Morphological responses to feeding in ticks (Ixodes ricinus)	30123529
PMC6065256	2018	86359	The Complexity of Piroplasms Life Cycles	30083518
PMC6130949	2018	67351	The rational design of affinity-attenuated OmCI for the purification of complement C5	30030376
PMC6076967	2018	17943	Coxiella burnetii Detected in Tick Samples from Pastoral Communities in Kenya	30105251
PMC6052906	2018	74693	Multiple Biogenic Amine Receptor Types Modulate Spider, Cupiennius salei, Mechanosensory Neurons	30050453
PMC6038233	2018	51012	Biological compatibility between two temperate lineages of brown dog ticks, Rhipicephalus sanguineus (sensu lato)	29986760
PMC6071252	2018	32035	Tick_Virus_Host Interactions at the Cutaneous Interface: The Nidus of Flavivirus Transmission	29986483
PMC6052676	2018	45168	The Tick Cell Biobank: A global resource for in vitro research on ticks, other arthropods and the pathogens they transmit	29886187
PMC6048076	2018	67614	Preliminary study on the tick population of Benin wildlife at the moment of its invasion by the Rhipicephalus microplus tick (Canestrini, 1888)	30034180
PMC6024845	2018	78636	Ticks and Tick-Borne Infections: Complex Ecology, Agents, and Host Interactions	29925800
PMC6037663	2018	69647	Differentially expressed genes in response to amitraz treatment suggests a proposed model of resistance to amitraz in R. decoloratus ticks	29986169
PMC6006283	2018	31771	Vector competence of Haemaphysalis longicornis ticks for a Japanese isolate of the Thogoto virus	29915199
PMC6016230	2018	29362	Comparative Hemolymph Proteomic and Enzymatic Analyses of Two Strains of Rhipicephalus (Boophilus) microplus Ticks Resistant and Susceptible to Ixodicides	29992168
PMC5995388	2018	64316	Risk of introduction of lumpy skin disease in France by the import of vectors in animal trucks	29889905
PMC6000140	2018	46341	How mammals stay healthy in nature: the evolution of behaviours to avoid parasites and pathogens	29866918
PMC5984736	2018	41713	Spatial and temporal distribution of lumpy skin disease outbreaks in Uganda (2002_2016)	29859091
PMC5984310	2018	85095	Mitochondrial phylogeography and population structure of the cattle tick Rhipicephalus appendiculatus in the African Great Lakes region	29855375
PMC5968504	2018	62016	De novo assembly and annotation of Hyalomma dromedarii tick (Acari: Ixodidae) sialotranscriptome with regard to gender differences in gene expression	29793520
PMC6024606	2018	87746	Tick Paralysis: Solving an Enigma	29757990
PMC6126638	2018	98867	Theileria parva antigens recognized by CD8+ T cells show varying degrees of diversity in buffalo-derived infected cell lines	29729680
PMC5945973	2018	98246	Rhipicephalus bursa Sialotranscriptomic Response to Blood Feeding and Babesia ovis Infection: Identification of Candidate Protective Antigens	29780749
PMC5935388	2018	56034	Selection and evaluation of housekeeping genes as endogenous controls for quantification of mRNA transcripts in Theileria parva using quantitative real-time polymerase chain reaction (qPCR)	29727459
PMC5956992	2018	44615	Antibodies to in silico selected GPI-anchored Theileria parva proteins neutralize sporozoite infection in vitro	29678234
PMC5937841	2018	51463	Neglected aspects of tick-borne rickettsioses	29690900
PMC5896090	2018	37596	Evaluation of a simple polytetrafluoroethylene (PTFE)-based membrane for blood-feeding of malaria and dengue fever vectors in the laboratory	29642937
PMC5911333	2018	23963	In Silico Characterization and Structural Modeling of Dermacentor andersoni p36 Immunosuppressive Protein	29849611
PMC5884543	2018	95389	Screening potential reference genes for quantitative real-time PCR analysis in the oriental armyworm, Mythimna separata	29617430
PMC5881173	2018	66290	Control of Cattle Ticks and Tick-Borne Diseases by Acaricide in Southern Province of Zambia: A Retrospective Evaluation of Animal Health Measures According to Current One Health Concepts	29637063
PMC5889886	2018	30790	Sensitivity of Different Cattle Breeds to the Infestation of Cattle Ticks Amblyomma variegatum, Rhipicephalus microplus, and Hyalomma spp. on the Natural Pastures of Opkara Farm, Benin	29770229
PMC6024560	2018	33402	Population Dynamics of Off-Host Rhipicephalus (Boophilus) microplus (Acari: Ixodidae) Larvae in Response to Habitat and Seasonality in South Texas	29570655
PMC5866268	2018	102723	Tick-Borne Viruses	29536246
PMC5978925	2018	19242	Molecular detection and characterization of Theileria spp. infecting cattle in Sennar State, Sudan	29516215
PMC5876571	2018	36961	Detection and Characterisation of Anaplasma marginale and A. centrale in South Africa	29510496
PMC5834894	2018	39382	Rhipicephalus appendiculatus ticks transmit Theileria parva from persistently infected cattle in the absence of detectable parasitemia: implications for East Coast fever epidemiology	29499743
