pmcid	year	count	title	pubmedid
PMC4322644	2015	35666	Rhipicephalus microplus serine protease inhibitor family: annotation, expression and functional characterisation assessment	25564202
PMC4356873	2015	65595	A review of Theileria diagnostics and epidemiology	25830110
PMC4356741	2014	175838	History and development of research on wildlife parasites in southern Africa, with emphasis on terrestrial mammals, especially ungulates	25830101
PMC4427740	2014	34252	The widely distributed hard tick, Haemaphysalis longicornis,can retain canine parvovirus, but not be infected in laboratory condition	25650060
PMC4429137	2014	53397	Transmission-Blocking Vaccines: Focus on Anti-Vector Vaccines against Tick-Borne Diseases	25503555
PMC4396072	2014	91988	Impact of biodiversity and seasonality on Lyme-pathogen transmission	25432469
PMC4226919	2014	49436	Antihistamine response: a dynamically refined function at the host-tick interface	25358914
PMC4210743	2014	8923	Ixodid Tick Infestation in Cattle and Wild Animals in Maswa and Iringa, Tanzania	25352709
PMC4448906	2014	30495	Conidia of the insect pathogenic fungus, Metarhizium anisopliae, fail to adhere to mosquito larval cuticle	26064542
PMC6014189	2015	32662	Morpho-histochemical characterization of the salivary glands of semi-engorged Amblyomma triste (Koch, 1844) (Acari: Ixodidae) female ticks	30023188
PMC4200143	2014	51033	Rhipicephalus (Boophilus) microplus aquaporin as an effective vaccine antigen to protect against cattle tick infestations	25306139
PMC4313706	2015	67497	Co-feeding transmission in Lyme disease pathogens	25295405
PMC4289259	2014	25812	First molecular detection of Rickettsia africae in ticks from the Union of the Comoros	25245895
PMC4262232	2014	41667	Collateral benefits of restricted insecticide application for control of African trypanosomiasis on Theileria parva in cattle: a randomized controlled trial	25199409
PMC4261526	2014	93345	The sialotranscriptome of Amblyomma triste, Amblyomma parvum and Amblyomma cajennense ticks, uncovered by 454-based RNA-seq	25201527
PMC4261563	2014	38603	Geographic distribution of non-clinical Theileria parva infection among indigenous cattle populations in contrasting agro-ecological zones of Uganda: implications for control strategies	25175844
PMC4141090	2014	58245	The Namaqua rock mouse (Micaelamys namaquensis) as a potential reservoir and host of arthropod vectors of diseases of medical and veterinary importance in South Africa	25127720
PMC4117442	2014	95530	Evidence for Circulation of the Rift Valley Fever Virus among Livestock in the Union of Comoros	25078616
PMC4116169	2014	238966	Transcriptome of the Female Synganglion of the Black-Legged Tick Ixodes scapularis (Acari: Ixodidae) with Comparison between Illumina and 454 Systems	25075967
PMC4109860	2014	73591	IrSPI, a Tick Serine Protease Inhibitor Involved in Tick Feeding and Bartonella henselae Infection	25057911
PMC4223420	2014	51895	Characterisation of a secretory serine protease inhibitor (SjB6) from Schistosoma japonicum	25023829
PMC4081574	2014	52988	Bayesian Spatio-Temporal Analysis and Geospatial Risk Factors of Human Monocytic Ehrlichiosis	24992684
PMC4078307	2014	33908	Disruption of aminergic signalling reveals novel compounds with distinct inhibitory effects on mosquito reproduction, locomotor function and survival	24984706
PMC4085379	2014	70366	Are ticks venomous animals?	25006341
PMC4099483	2014	156652	A 24-48 h fed Amblyomma americanum tick saliva immuno-proteome	24962723
PMC4065726	2014	22379	Evaluation of Antibody Response to Various Developmental Stage Specific Somatic Antigens of Paramphistomum epiclitum in Goats	24995303
PMC4060021	2014	57629	The salivary secretome of the biting midge, Culicoides sonorensis	24949243
PMC4039488	2014	54690	Knockdown of the Rhipicephalus microplus Cytochrome c Oxidase Subunit III Gene Is Associated with a Failure of Anaplasma marginale Transmission	24878588
PMC4031064	2014	60034	Incidence of Human Taenia solium Larval Infections in an Ecuadorian Endemic Area: Implications for Disease Burden Assessment and Control	24852050
PMC4038084	2014	37732	History and complexity in tick-host dynamics: discrepancies between 'real' and 'visible' tick populations	24885852
PMC4113304	2014	37927	A longitudinal assessment of the serological response to Theileria parva and other tick-borne parasites from birth to one year in a cohort of indigenous calves in western Kenya	24838078
PMC3998978	2014	201704	Proteomic Analysis of Cattle Tick Rhipicephalus (Boophilus) microplus Saliva: A Comparison between Partially and Fully Engorged Females	24762651
PMC4021724	2014	47597	Invasive potential of cattle fever ticks in the southern United States	24742062
PMC3986078	2014	54465	Novel Identification of Dermacentor variabilis Arp2/3 Complex and Its Role in Rickettsial Infection of the Arthropod Vector	24733187
PMC3979861	2014	72665	The Nairovirus Nairobi Sheep Disease Virus/Ganjam Virus Induces the Translocation of Protein Disulphide Isomerase-Like Oxidoreductases from the Endoplasmic Reticulum to the Cell Surface and the Extracellular Space	24714576
PMC3979764	2014	60512	Genetic Diversity of Salp15 in the Ixodes ricinus Complex (Acari: Ixodidae)	24714063
PMC3967966	2014	44684	Identification of Parasitic Communities within European Ticks Using Next-Generation Sequencing	24675738
PMC3953445	2014	74613	Intracellular Theileria annulata Promote Invasive Cell Motility through Kinase Regulation of the Host Actin Cytoskeleton	24626571
PMC3973879	2014	43859	Prevalence and spatial distribution of Theileria parva in cattle under crop-livestock farming systems in Tororo District, Eastern Uganda	24589227
PMC4629589	2014	13814	Ectoparasites infestation of free-ranging hedgehog (Etelerix algirus) in north western Libya	26623333
PMC3930515	2014	42787	Parasite Co-Infections and Their Impact on Survival of Indigenous Cattle	24586220
PMC3945150	2014	27034	Repellent Activities of Essential Oils of Some Plants Used Traditionally to Control the Brown Ear Tick, Rhipicephalus appendiculatus	24693417
PMC3949003	2014	10429	Gene Cloning, Expression and Immunogenicity of the Protective Antigen Subolesin in Dermacentor silvarum	24623890
PMC3907338	2014	73808	Hard Tick Factors Implicated in Pathogen Transmission	24498444
PMC3905284	2014	67519	Present and future potential of plant-derived products to control arthropods of veterinary and medical significance	24428899
PMC3890586	2014	88995	Understanding the evolutionary structural variability and target specificity of tick salivary Kunitz peptides using next generation transcriptome data	24397261
PMC4029082	2014	28269	Functional characterisation of a nicotinic acetylcholine receptor alpha subunit from the brown dog tick, Rhipicephalus sanguineus<xref ref-type="fn" rid="d32e305">&#x2606;</xref>	24291321
PMC4199359	2014	40468	Selection and validation of reference genes for functional studies in the Calliphoridae family	25373149
PMC3928524	2014	71782	Sequence-based Gaussian network model for protein dynamics	24336646
PMC3833115	2013	48669	Ticks and tick-borne pathogens at the cutaneous interface: host defenses, tick countermeasures, and a suitable environment for pathogen establishment	24312085
PMC3820542	2013	45761	RPS8-a New Informative DNA Marker for Phylogeny of Babesia and Theileria Parasites in China	24244571
PMC4237192	2014	50788	Molecular and functional characterization of vacuolar-ATPase from the American dog tick Dermacentor variabilis	24164319
PMC3801108	2013	74120	A Nod to disease vectors: mitigation of pathogen sensing by arthropod saliva	24155744
PMC3795742	2013	58815	Identification and Structural-Functional Analysis of Cyclin-Dependent Kinases of the Cattle Tick Rhipicephalus (Boophilus) microplus	24146826
PMC3810746	2013	8249	Rickettsia africae in Amblyomma variegatum Ticks, Uganda and Nigeria	24050756
PMC3848863	2013	26480	New data regarding distribution of cattle ticks in the south-western Indian Ocean islands	24016261
PMC3847357	2013	149148	Beyond case fatality rate: using potential impact fraction to estimate the effect of increasing treatment uptake on mortality	24006924
PMC3829697	2013	54431	Parasite co-infections show synergistic and antagonistic interactions on growth performance of East African zebu cattle under one year	24001119
PMC3875883	2013	18180	Detection of Naturally Infected Vector Ticks (Acari: Ixodidae) by Different Species of Babesia and Theileria Agents from Three Different Enzootic Parts of Iran	24409442
PMC3756306	2013	57298	Changing geographic ranges of ticks and tick-borne pathogens: drivers, mechanisms and consequences for pathogen diversity	24010124
PMC3753264	2013	47244	Transcriptome Analysis of Litopenaeus vannamei in Response to White Spot Syndrome Virus Infection	23991181
PMC3747359	2013	124684	Tick salivary compounds: their role in modulation of host defences and pathogen transmission	23971008
PMC3737478	2013	55529	Research on the ecology of ticks and tick-borne pathogens-methodological principles and caveats	23964348
PMC3742048	2013	21691	Relationship between the Prevalence of Ectoparasites and Associated Risk Factors in Free-Range Pigs in Kenya	23984085
PMC3735430	2013	137821	Morphological and genetic diversity of Rhipicephalus sanguineus sensu lato from the New and Old Worlds	23880226
PMC3709243	2013	34725	Endogenous tick viruses and modulation of tick-borne pathogen growth	23875176
PMC3722975	2013	22543	Use of Metarhizium anisopliae Chitinase Genes for Genotyping and Virulence Characterization	23936804
PMC3705209	2013	56438	Tick vaccines and the control of tick-borne pathogens	23847771
PMC3695081	2013	87673	Novel Immunomodulators from Hard Ticks Selectively Reprogramme Human Dendritic Cell Responses	23825947
PMC3689731	2013	72610	From Chemistry to Behavior. Molecular Structure and Bioactivity of Repellents against Ixodes ricinus Ticks	23805329
PMC3681633	2013	65588	Ixodid ticks of traditionally managed cattle in central Nigeria: where Rhipicephalus (Boophilus) microplus does not dare (yet?)	23758913
PMC4312380	2013	19915	Ectoparasitic infestations of the European hedgehog (Erinaceus europaeus) in Urmia city, Iran: First report	25653796
PMC3643938	2013	66927	Tryptogalinin Is a Tick Kunitz Serine Protease Inhibitor with a Unique Intrinsic Disorder	23658744
PMC3641128	2013	84896	Detection and Characterization of Tick-Borne Encephalitis Virus in Baltic Countries and Eastern Poland	23650497
PMC3696655	2013	86845	Bifunctional Lipocalin Ameliorates Murine Immune Complex-induced Acute Lung Injury<xref ref-type="fn" rid="FN1"><inline-graphic xlink:href="sbox.jpg"/></xref>	23625922
PMC3636972	2013	77802	Review of evidence for immune evasion and persistent infection in Lyme disease	23637552
PMC3684493	2013	16403	A Field Experiment to Assess the Rate of Infestation in Honey Bee Populations of Two Metarhizium anisopliae Isolates on Varroa destructor (Acari: Mesostigmata)	23785691
PMC3718523	2013	32440	Hyalomma scupense (Acari, Ixodidae) in northeast Tunisia: seasonal population dynamics of nymphs and adults on field cattle	23547915
PMC3629083	2013	70489	Cattle and climate in Africa: How climate variability has influenced national cattle holdings from 1961_2008	23638393
PMC3592534	2013	27485	Coxiella burnetii in Humans, Domestic Ruminants, and Ticks in Rural Western Kenya	23382156
PMC3616916	2013	85735	Why so many unknown genes? Partitioning orphans from a representative transcriptome of the lone star tick Amblyomma americanum	23445305
PMC3684749	2013	97816	An analysis of two island groups as potential sites for trials of transgenic mosquitoes for malaria control	23789035
PMC3686427	2013	70731	Whole-Genome Sequencing of Theileria parva Strains Provides Insight into Parasite Migration and Diversification in the African Continent	23404454
PMC3569838	2013	73087	Vaccination against Lyme disease: past, present, and future	23407755
PMC3862501	2012	47688	Tick infestation patterns in free ranging African buffalo (Syncercus caffer): Effects of host innate immunity and niche segregation among tick species<xref ref-type="fn" rid="d32e442">&#x2606;</xref>	24533310
PMC3556501	2012	39460	Tick infestations in extensively grazed cattle and efficacy trial of high-ciscypermethrin pour-on preparation for control of ticks in Mvomero district inTanzania	23164198
PMC3671455	2012	30989	Theileria, Babesia, and Anaplasma detected by PCR in ruminant herds at Bie Province, Angola	23193527
PMC3503576	2012	66045	Population genetic analysis and sub-structuring of Theileria parva in the northern and eastern parts of Zambia	23146577
PMC3507801	2012	49194	Ganjam virus/Nairobi sheep disease virus induces a pro-inflammatory response in infected sheep	23083136
PMC3471850	2012	46421	Early Immunologic Events at the Tick-Host Interface	23077588
PMC3503595	2012	38805	Ixodes scapularis saliva mitigates inflammatory cytokine secretion during Anaplasma phagocytophilum stimulation of immune cells	23050849
PMC3575351	2012	83436	High-resolution genotyping and mapping of recombination and gene conversion in the protozoan Theileria parva using whole genome sequencing	22998600
PMC3465218	2012	68401	Epidemiology of East Coast fever (Theileria parva infection) in Kenya: past, present and the future	22958352
PMC3436708	2012	96661	Analysis of Babesia bovis infection-induced gene expression changes in larvae from the cattle tick, Rhipicephalus (Boophilus) microplus	22871314
PMC7112590	2012	30820	Transcriptional profiling of inflammatory cytokine genes in African buffaloes (Syncerus caffer) infected with Theileria parva	22854202
PMC3394726	2012	78257	Novel Scabies Mite Serpins Inhibit the Three Pathways of the Human Complement System	22792350
PMC3557390	2012	57309	Gene silencing in tick cell lines using small interfering or long double-stranded RNA	22773071
PMC3528165	2012	16651	Analysis of Immunogenic Relevant Proteins in Rhipicephalus (Boophilus) annulatus Tick	23293777
PMC3382467	2012	70158	Consequences of Landscape Fragmentation on Lyme Disease Risk: A Cellular Automata Approach	22761842
PMC3431536	2012	31238	Detection and identification of putative bacterial endosymbionts and endogenous viruses in tick cell lines<xref ref-type="fn" rid="d32e1849">&#x2606;</xref>	22743047
PMC3371346	2012	27760	Detection of Parasites and Parasitic Infections of Free-Ranging Wildlife on a Game Ranch in Zambia: A Challenge for Disease Control	22701163
PMC3358300	2012	64833	Occurrence Patterns of Afrotropical Ticks (Acari: Ixodidae) in the Climate Space Are Not Correlated with Their Taxonomic Relationships	22629349
PMC3386632	2012	72045	Disintegrins from Hematophagous Sources	22778902
PMC3313475	2012	64620	Impact of Climate Trends on Tick-Borne Pathogen Transmission	22470348
PMC3313923	2012	41456	Taenia solium Infections in a Rural Area of Eastern Zambia-A Community Based Study	22479664
PMC3303826	2012	31390	Molecular Cloning and Sequence Analysis of the cDNAs Encoding Toxin-Like Peptides from the Venom Glands of Tarantula Grammostola rosea	22500178
PMC3296124	2012	43508	Modelling the transmission dynamics of Theileria annulata: model structure and validation for the Turkish context	22309815
PMC3433664	2012	131104	The role of nuclear technologies in the diagnosis and control of livestock diseases-a review	22286376
PMC3264636	2012	58352	The Immunomodulation of Acetylcholinesterase in Zhikong Scallop Chlamys farreri	22292052
PMC3273431	2012	72031	Evolution, expansion and expression of the Kunitz/BPTI gene family associated with long-term blood feeding in Ixodes Scapularis	22244187
PMC3244413	2011	89747	A Deep Insight into the Sialotranscriptome of the Gulf Coast Tick, Amblyomma maculatum	22216098
PMC3279686	2011	10043	Detection of Babesia spp. in Free-Ranging Pukus, Kobus vardonii, on a Game Ranch in Zambia	22355215
PMC3246798	2012	69992	Rapid Molecular Detection Methods for Arboviruses of Livestock of Importance to Northern Europe	22219660
PMC3230622	2011	69797	Inhibition of Interferon Induction and Action by the Nairovirus Nairobi Sheep Disease Virus/Ganjam Virus	22163042
PMC3768737	2011	21080	Biocontrol of pigeon tick Argas reflexus (Acari: Argasidae) by entomopathogenic fungus Metarhizium Anisopliae (Ascomycota: Hypocreales)	24031777
PMC3197560	2011	75711	Implication of haematophagous arthropod salivary proteins in host-vector interactions	21951834
PMC3189156	2011	23671	Identification of mosquito repellent odours from Ocimum forskolei	21936953
PMC7123612	2011	172911	Zoonoses Animal and Human Diseases Endo and Ectoparasites Mainly Mammal I	
PMC3381575	2011	25806	Crimean-Congo Hemorrhagic Fever Virus in Hyalommid Ticks, Northeastern Kenya	21801635
PMC3160391	2011	75719	The complexity of Rhipicephalus (Boophilus) microplus genome characterised through detailed analysis of two BAC clones	21777481
PMC3141747	2011	49662	Fibrinogen-related proteins in ixodid ticks	21729260
PMC3135125	2011	45218	Allergic Responses Induced by a Fungal Biopesticide Metarhizium anisopliae and House Dust Mite Are Compared in a Mouse Model	21785589
PMC3084458	2011	33381	Construction of a genetic map for Theileria parva: Identification of hotspots of recombination	21310160
PMC3084734	2011	114807	Two Theileria parva CD8 T Cell Antigen Genes Are More Variable in Buffalo than Cattle Parasites, but Differ in Pattern of Sequence Diversity	21559495
PMC3094394	2011	21721	Why is Southern African canine babesiosis so virulent? An evolutionary perspective	21489239
PMC3069959	2011	27500	Colonization of Grande Comore Island by a lineage of Rhipicephalus appendiculatus ticks	21414194
PMC3060141	2011	57329	A further insight into the sialome of the tropical bont tick, Amblyomma variegatum	21362191
PMC3279866	2011	26946	In-Vitro Assessment of the Acaricidal Properties of Artemisia annua and Zataria multiflora Essential Oils to Control Cattle Ticks	22347275
PMC3068256	2011	24564	Haplotypes of the bovine IgG2 heavy gamma chain in tick-resistant and tick-susceptible breeds of cattle	21301827
PMC3031531	2011	46791	Evidence for D1 Dopamine Receptor Activation by a Paracrine Signal of Dopamine in Tick Salivary Glands	21297964
PMC3022847	2011	48168	Hemelipoglycoprotein from the ornate sheep tick, dermacentor marginatus: structural and functional characterization	21214898
PMC3016337	2011	64849	Identification and Characterization of Ixodes scapularis Antigens That Elicit Tick Immunity Using Yeast Surface Display	21246036
PMC3017071	2010	24675	Investigating effects of parasite infection on body condition of the Kafue lechwe (Kobus leche kafuensis) in the Kafue basin	21182793
PMC3016361	2010	53574	Dynamics of digestive proteolytic system during blood feeding of the hard tick Ixodes ricinus	21156061
PMC2998001	2010	45694	Bm86 homologues and novel ATAQ proteins with multiple epidermal growth factor (EGF)-like domains from hard and soft ticks<xref ref-type="fn" rid="d32e2453">&#x2606;</xref>	20647015
PMC2994843	2010	48955	The Rhipicephalus (Boophilus) microplus Bm86 gene plays a critical role in the fitness of ticks fed on cattle during acute Babesia bovis infection	21092112
PMC7119992	2010	544791	Systematic Survey of Zoonotic and Sapronotic Microbial Agents	
PMC2989326	2010	44240	Bm86 midgut protein sequence variation in South Texas cattle fever ticks	21047431
PMC2994296	2010	3936	GIS in vector borne diseases	
PMC2972281	2010	49006	Evaluation of endogenous references for gene expression profiling in different tissues of the oriental fruit fly Bactrocera dorsalis (Diptera: Tephritidae)	20923571
PMC2933685	2010	43446	Gene-knockdown in the honey bee mite Varroa destructor by a non-invasive approach: studies on a glutathione S-transferase	20712880
PMC3091647	2010	79543	An insight into the sialotranscriptome of the brown dog tick, Rhipicephalus sanguineus	20650005
PMC3224725	2010	98606	Comparative microarray analysis of Rhipicephalus (Boophilus) microplus expression profiles of larvae pre-attachment and feeding adult female stages on Bos indicus and Bos taurus cattle	20637126
PMC2992130	2010	55255	Attachment site selection of ticks on roe deer, Capreolus capreolus	20585837
PMC2901319	2010	94298	The expression of genes coding for distinct types of glycine-rich proteins varies according to the biology of three metastriate ticks, Rhipicephalus (Boophilus) microplus, Rhipicephalus sanguineus and Amblyomma cajennense	20529354
PMC2890244	2010	70073	Comparison of Entropic Contributions to Binding in a "Hydrophilic" versus "Hydrophobic" Ligand&#x2212;Protein Interaction	20524663
PMC2896810	2010	148763	Rift Valley fever virus (Bunyaviridae: Phlebovirus): an update on pathogenesis, molecular epidemiology, vectors, diagnostics and prevention	21188836
PMC2861667	2010	23175	Cold storage and cryopreservation of tick cell lines	20388200
PMC2848250	2010	58367	Differential expression of genes in salivary glands of male Rhipicephalus (Boophilus)microplus in response to infection with Anaplasma marginale	20298599
PMC2825549	2009	25410	Biogeography of Tick-Borne Bhanja Virus (Bunyaviridae) in Europe	20182535
PMC2817781	2010	24892	Genotypic diversity, a survival strategy for the apicomplexan parasite Theileria parva	19837514
PMC2911586	2009	33592	Vaccine Efficacy of Bm86 Ortholog of H. a. anatolicum, rHaa86 Expressed in Prokaryotic Expression System	20721331
PMC3385533	2009	17830	Laboratory Study on Biological Control of Ticks (Acari: Ixodidae) by Entomopathogenic Indigenous Fungi (Beauveria bassiana)	22808380
PMC2809063	2009	72575	Selection of reference genes for quantitative RT-PCR studies in Rhipicephalus (Boophilus) microplus and Rhipicephalus appendiculatus ticks and determination of the expression profile of Bm86	20040102
PMC2785768	2009	52345	Silencing of a putative immunophilin gene in the cattle tick Rhipicephalus (Boophilus) microplus increases the infection rate of Babesia bovis in larval progeny	19930572
PMC2789330	2009	35982	Feeding-associated gene expression in sheep scab mites (Psoroptes ovis)	19852923
PMC2714835	2009	49689	Silencing of genes involved in Anaplasma marginale-tick interactions affects the pathogen developmental cycle in Dermacentor variabilis	19607704
PMC2713677	2009	35986	Anchoring tick salivary anti-complement proteins IRAC I and IRAC II to membrane increases their immunogenicity	19531344
PMC2695027	2009	50235	Changing patterns of West Nile virus transmission: altered vector competence and host susceptibility	19406093
PMC2695030	2009	78831	The relationship between spotted fever group Rickettsiae and Ixodid ticks	19358804
PMC2679396	2009	42115	Canine babesiosis: from molecular taxonomy to control	19426443
PMC2656471	2009	78807	Allopatric speciation in ticks: genetic and reproductive divergence between geographic strains of Rhipicephalus (Boophilus) microplus	19243585
PMC2601031	2008	80069	Ixodes ricinus Tick Lipocalins: Identification, Cloning, Phylogenetic Analysis and Biochemical Characterization	19096708
PMC2600610	2008	63089	Ir-LBP, an Ixodes ricinus Tick Salivary LTB4-Binding Lipocalin, Interferes with Host Neutrophil Function	19096526
PMC2644717	2008	212855	Exploring the mialome of ticks: an annotated catalogue of midgut transcripts from the hard tick, Dermacentor variabilis (Acari: Ixodidae)	19021911
PMC2435602	2008	30463	Climate Extremes Promote Fatal Co-Infections during Canine Distemper Epidemics in African Lions	18575601
PMC2426694	2008	84841	Molecular evolution of Cide family proteins: Novel domain formation in early vertebrates and the subsequent divergence	18500987
PMC2410133	2008	143764	Insight into the sialome of the castor bean tick, Ixodes ricinus	18489795
PMC2358973	2008	74912	A Cysteine Protease Is Critical for Babesia spp. Transmission in Haemaphysalis Ticks	18483546
PMC2315649	2008	50280	Revealing pancrustacean relationships: Phylogenetic analysis of ribosomal protein genes places Collembola (springtails) in a monophyletic Hexapoda and reinforces the discrepancy between mitochondrial and nuclear DNA markers	18366624
PMC2235897	2008	24497	Salivating for Knowledge: Potential Pharmacological Agents in Tick Saliva	18271624
PMC2254393	2008	92270	Distantly related lipocalins share two conserved clusters of hydrophobic residues: use in homology modeling	18190694
PMC2151134	2008	181974	Variability and Action Mechanism of a Family of Anticomplement Proteins in Ixodes ricinus	18167559
PMC7150229	2008	285576	Minus-Strand RNA Viruses	
PMC2628564	2007	14404	Live immunisation against Theileria parva: containing or spreading the disease?	17964219
PMC2999452	2007	39415	Phagocytosis of the Lyme Disease Spirochete, Borrelia burgdorferi, by Cells from the Ticks, Ixodes scapularis and Dermacentor andersoni, Infected with An Endosymbiont, Rickettsia peacockii	20331397
PMC2042005	2007	52383	Surveillance of Arthropod Vector-Borne Infectious Diseases Using Remote Sensing Techniques: A Review	17967056
PMC2100071	2007	67538	Global comparative analysis of ESTs from the southern cattle tick, Rhipicephalus (Boophilus) microplus	17935616
PMC1904224	2007	36689	Cytokine responses of CD4+ T cells during a Plasmodium chabaudi chabaudi (ER) blood-stage infection in mice initiated by the natural route of infection	17555592
PMC1866177	2007	79150	Immunity against Ixodes scapularis Salivary Proteins Expressed within 24 Hours of Attachment Thwarts Tick Feeding and Impairs Borrelia Transmission	17505544
PMC1885961	2007	37249	Gene silencing of the tick protective antigens, Bm86, Bm91 and subolesin, in the one-host tick Boophilus microplus by RNA interference	17196597
PMC1762403	2006	47343	Novel Acetylcholinesterase Target Site for Malaria Mosquito Control	17183688
PMC3291068	2006	59884	Tickborne Arbovirus Surveillance in Market Livestock, Nairobi, Kenya	16836823
PMC7135140	2006	102931	Viral Hemorrhagic Fevers: Current Status of Endemic Disease and Strategies for Control	16762743
PMC1464127	2006	52306	Comparative genomics of the syndecans defines an ancestral genomic context associated with matrilins in vertebrates	16620374
PMC1424664	2006	41034	An Antivector Vaccine Protects against a Lethal Vector-Borne Pathogen	16604154
