pmcid	year	count	title	pubmedid
PMC5854372	2018	60302	Ancient diversity and geographical sub-structuring in African buffalo Theileria parva populations revealed through metagenetic analysis of antigen-encoding loci<xref ref-type="fn" rid="d31e960">&#x2606;</xref>	29408266
PMC5854367	2018	61003	Characterization of the Theileria parva sporozoite proteome	29258832
PMC5806375	2018	64312	Characterization and expression analysis of a newly identified glutathione S-transferase of the hard tick Haemaphysalis longicornis during blood-feeding	29422079
PMC5806362	2018	30984	Proteomics analysis of faecal proteins in the tick Haemaphysalis flava	29422072
PMC5893389	2018	16898	Investigation of an isolated case of human Crimean_Congo hemorrhagic fever in Central Uganda, 2015<xref ref-type="fn" rid="FN2">&#x2606;</xref>	29382607
PMC5813511	2018	81049	Exploring knowledge and management practices on ticks and tick-bornediseases among agro-pastoral communities in Southern Highlands,Tanzania	29479157
PMC5798814	2018	68437	A roadmap for breeding orphan leafy vegetable species: a case study of Gynandropsis gynandra (Cleomaceae)	29423232
PMC5775380	2018	27074	Evaluation of a semi-automated in vitro feeding system for Dermacentor reticulatus and Ixodes ricinus adults	29297094
PMC7110891	2018	27166	Climate change and multiple emerging infectious diseases<xref ref-type="fn" rid="d32e611">&#x2606;</xref>	29680392
PMC5744076	2017	82709	A Roadmap for Tick-Borne Flavivirus Research in the "Omics" Era	29312896
PMC5742187	2017	81719	Bovine Immune Factors Underlying Tick Resistance: Integration and Future Directions	29312898
PMC5742094	2017	56798	Tick-Host Range Adaptation: Changes in Protein Profiles in Unfed Adult Ixodes scapularis and Amblyomma americanum Saliva Stimulated to Feed on Different Hosts	29312895
PMC5741700	2017	93464	Ticks, Ixodes scapularis, Feed Repeatedly on White-Footed Mice despite Strong Inflammatory Response: An Expanding Paradigm for Understanding Tick_Host Interactions	29326693
PMC5731699	2017	79039	Application of system dynamics and participatory spatial group model building in animal health: A case study of East Coast Fever interventions in Lundazi and Monze districts of Zambia	29244862
PMC5732177	2017	95625	Cattle Tick Rhipicephalus microplus-Host Interface: A Review of Resistant and Susceptible Host Responses	29322033
PMC5718069	2017	43917	Experimental therapeutic assays of Tephrosia vogelii against Leishmania major infection in murine model: in vitro and in vivo	29208030
PMC6238707	2017	46416	Investigation of the acaricidal activity of the acetone and ethanol extracts of 12 South African plants against the adult ticks of Rhipicephalus turanicus	29227130
PMC5700055	2017	34434	Structural basis of cholesterol binding by a novel clade of dendritic cell modulators from ticks	29167574
PMC5702332	2017	115366	Analysis of the Salivary Gland Transcriptome of Unfed and Partially Fed Amblyomma sculptum Ticks and Descriptive Proteome of the Saliva	29209593
PMC5748392	2017	128396	Strategies for the control of Rhipicephalus microplus ticks in a world of conventional acaricide and macrocyclic lactone resistance	29152691
PMC5947171	2017	167271	Tick attachment cement _ reviewing the mysteries of a biological skin plug system	29119723
PMC5674927	2017	88544	Tick-Borne Transmission of Murine Gammaherpesvirus 68	29164067
PMC5746801	2017	155365	The Biology and Ecology of Cat Fleas and Advancements in Their Pest Management: A Review	29077073
PMC5812510	2017	111740	Broad-range survey of vector-borne pathogens and tick host identification of Ixodes ricinus from Southern Czech Republic	29029144
PMC5627281	2017	39623	Deciphering Babesia-Vector Interactions	29034218
PMC5622192	2017	67556	Gene Duplication and Protein Evolution in Tick-Host Interactions	28993800
PMC5613835	2017	56616	Field evaluation of poultry red mite (Dermanyssus gallinae) native and recombinant prototype vaccines	28917313
PMC5602048	2017	235557	Gut contents, digestive half-lives and feeding state prediction in the soil predatory mite Pergamasus longicornis (Mesostigmata: Parasitidae)	28865060
PMC5575040	2017	40946	Expression and characterisation of a Sarcoptes scabiei protein tyrosine kinase as a potential antigen for scabies diagnosis	28852108
PMC5565970	2017	71120	Flavivirus Infection of Ixodes scapularis (Black-Legged Tick) Ex Vivo Organotypic Cultures and Applications for Disease Control	28830948
PMC5568440	2017	44553	Assessment and optimization of Theileria parva sporozoite full-length p67 antigen expression in mammalian cells	28800590
PMC5553602	2017	94558	Sialotranscriptomics of Rhipicephalus zambeziensis reveals intricate expression profiles of secretory proteins and suggests tight temporal transcriptional regulation during blood-feeding	28797301
PMC5552662	2017	74237	Vaccinomics Approach to the Identification of Candidate Protective Antigens for the Control of Tick Vector Infestations and Anaplasma phagocytophilum Infection	28848718
PMC5526847	2017	128132	Tick-Borne Viruses and Biological Processes at the Tick-Host-Virus Interface	28798904
PMC5542699	2017	125761	Molecular and MALDI-TOF identification of ticks and tick-associated bacteria in Mali	28742123
PMC5536051	2017	90492	Tick Haller's Organ, a New Paradigm for Arthropod Olfaction: How Ticks Differ from Insects	28718821
PMC5536150	2017	52957	Potential of Traditional Knowledge of Plants in the Management of Arthropods in Livestock Industry with Focus on (Acari) Ticks	28798806
PMC5537681	2017	22346	Synchronous Langat Virus Infection of Haemaphysalis longicornis Using Anal Pore Microinjection	28714929
PMC5504652	2017	50230	Emerging Tick-Borne Viruses in the Twenty-First Century	28744449
PMC5519660	2017	48458	Genetic parameters for tick counts across months for different tick species and anatomical locations in South African Nguni cattle	28687941
PMC5479950	2017	144672	The Essential Role of Tick Salivary Glands and Saliva in Tick Feeding and Pathogen Transmission	28690983
PMC5509036	2017	54210	Evolution of miRNA Tailing by 3&#x2032; Terminal Uridylyl Transferases in Metazoa	28633361
PMC5462927	2017	211761	Signatures of Selection for Environmental Adaptation and Zebu &#xD7; Taurine Hybrid Fitness in East African Shorthorn Zebu	28642786
PMC5715920	2017	82100	Mode of Infection of Metarhizium spp. Fungus and Their Potential as Biological Control Agents	29371548
PMC5451513	2017	165379	Molecular Detection of Tick-Borne Pathogen Diversities in Ticks from Livestock and Reptiles along the Shores and Adjacent Islands of Lake Victoria and Lake Baringo, Kenya	28620610
PMC5447049	2017	104278	Protease Inhibitors in Tick Saliva: The Role of Serpins and Cystatins in Tick-host-Pathogen Interaction	28611951
PMC5438962	2017	180474	Serine Protease Inhibitors in Ticks: An Overview of Their Role in Tick Biology and Tick-Borne Pathogen Transmission	28589099
PMC6001969	2017	80374	Modeling Lyme disease transmission	29928739
PMC5433414	2017	34452	Effects of Medicinal Plant Extracts and Photosensitization on Aflatoxin Producing Aspergillus flavus (Raper and Fennell)	28539938
PMC5406933	2017	75372	Mining a differential sialotranscriptome of Rhipicephalus microplus guides antigen discovery to formulate a vaccine that reduces tick infestations	28446245
PMC5413868	2017	50864	Interacting effects of land use and climate on rodent-borne pathogens in central Kenya	28438909
PMC5437174	2017	45403	Phenotypic and genotypic identification of hard ticks of the genus Haemaphysalis (Acari: Ixodidae) in Peninsular Malaysia	28409404
PMC5383669	2017	67170	Tick-Pathogen Interactions and Vector Competence: Identification of Molecular Drivers for Tick-Borne Diseases	28439499
PMC6238723	2017	35285	Lumpy skin disease in cattle: Frequency of occurrence in a dairy farm and a preliminary assessment of its possible impact on Egyptian buffaloes	28397517
PMC5361777	2017	79810	A repertoire of protease inhibitor families in Amblyomma americanum and other tick species: inter-species comparative analyses	28330502
PMC5629291	2017	24203	Drug Induced Sialorrhea and Microfluidic-Chip-Electrophoretic Analysis of Engorged Adult Female Tick Saliva of Haemaphysalis longicornis (Acari: Ixodidae)	29026848
PMC6238695	2017	42608	Parasites of domestic and wild animals in South Africa. L. Ixodid ticks infesting horses and donkeys	28281774
PMC5327538	2017	33510	Genetic profiling for Anaplasma and Ehrlichia species in ticks collected in the Eastern Cape Province of South Africa	28241784
PMC5355191	2017	48792	Re-establishing the pecking order: Niche models reliably predict suitable habitats for the reintroduction of red-billed oxpeckers	28331604
PMC5322890	2017	49457	Genes encoding two Theileria parva antigens recognized by CD8+ T-cells exhibit sequence diversity in South Sudanese cattle populations but the majority of alleles are similar to the Muguga component of the live vaccine cocktail	28231338
PMC5322884	2017	120013	Bioinformatic prediction of G protein-coupled receptor encoding sequences from the transcriptome of the foreleg, including the Haller's organ, of the cattle tick, Rhipicephalus australis	28231302
PMC5312532	2017	46323	Repellent effects of the essential oils of Cymbopogon citratus and Tagetes minuta on the sandfly, Phlebotomus duboscqi	28202077
PMC5307778	2017	88312	Proteases of haematophagous arthropod vectors are involved in blood-feeding, yolk formation and immunity - a review	28193252
PMC5850802	2017	45007	The Detection of Spotted Fever Group Rickettsia DNA in Tick Samples From Pastoral Communities in Kenya	28073909
PMC5788073	2017	35050	Minimum transmission time of Cytauxzoon felis by Amblyomma americanum to domestic cats in relation to duration of infestation, and investigation of ingestion of infected ticks as a potential route of transmission	28151047
PMC5288953	2017	38193	Optimization of an artificial tick feeding assay for Dermacentor reticulatus	28148282
PMC5282843	2017	104152	Immune and biochemical responses in skin differ between bovine hosts genetically susceptible and resistant to the cattle tick Rhipicephalus microplus	28143523
PMC5302141	2017	21675	Blocking transmission of vector-borne diseases	28189117
PMC6238675	2017	114488	Parasites of domestic and wild animals in South Africa. XLIX. Ticks (Acari: Ixodidae) infesting white and black rhinoceroses in southern Africa	28155285
PMC5226345	2017	61702	Environmental Factors Affecting Survival of Immature Ixodes scapularis and Implications for Geographical Distribution of Lyme Disease: The Climate/Behavior Hypothesis	28076359
PMC6155835	2017	50570	Biological Importance of Cotton By-Products Relative to Chemical Constituents of the Cotton Plant	28067842
PMC5237467	2017	87626	Lippia javanica (Burm.f.) Spreng.: Traditional and Commercial Uses and Phytochemical and Pharmacological Significance in the African and Indian Subcontinent	28115974
PMC5201281	2016	58566	Establishment of an Artificial Tick Feeding System to Study Theileria lestoquardi Infection	28036364
PMC5299472	2016	68441	Approaches to vaccination against Theileria parva and Theileria annulata	27647496
PMC5158090	2016	47113	Tick-Borne Diseases in Turkey: A Review Based on One Health Perspective	27977689
PMC5157944	2016	67127	Serological Evidence of Contrasted Exposure to Arboviral Infections between Islands of the Union of Comoros (Indian Ocean)	27977670
PMC5142468	2016	12900	Detection of Theileria parva in tissues of cattle undergoing severe East Coast fever disease show significant parasite DNA accumulation in the spleen	27890079
PMC5148907	2016	62320	Effect of the saliva from different triatomine species on the biology and immunity of TLR-4 ligand and Trypanosoma cruzi-stimulated dendritic cells	27938380
PMC5135042	2016	105439	Transfected Babesia bovis Expressing a Tick GST as a Live Vector Vaccine	27911903
PMC5136642	2016	16606	Occurrence of Ticks in Cattle in the New Pastoral Farming Areas in Rufiji District, Tanzania	27990463
PMC5104375	2016	43999	Machine Learning for Characterization of Insect Vector Feeding	27832081
PMC5104439	2016	114434	Mitochondrial Genome Sequences and Structures Aid in the Resolution of Piroplasmida phylogeny	27832128
PMC5101216	2016	64291	Experiences in Tick Control by Acaricide in the Traditional Cattle Sector in Zambia and Burkina Faso: Possible Environmental and Public Health Implications	27882313
PMC5098211	2016	27620	Structure and Function of FS50, a salivary protein from the flea Xenopsylla cheopis that blocks the sodium channel NaV1.5	27819327
PMC7094257	2017	81454	Invertebrate RNA virus diversity from a taxonomic point of view	27793741
PMC5057483	2016	24902	Pathogenic potential and growth kinetics of Muko virus in mice and human-derived cells	27777508
PMC5606593	2016	32178	Microscopic Visualisation of Zoonotic Arbovirus Replication in Tick Cell and Organ Cultures Using Semliki Forest Virus Reporter Systems	29056736
PMC5035468	2016	43350	Arbovirosis and potential transmission blocking vaccines	27664127
PMC5027092	2016	34060	Specific histamine binding activity of a new lipocalin from Hyalomma asiaticum (Ixodidae) and therapeutic effects on allergic asthma in mice	27639693
PMC5026199	2016	14316	Virus Discovery Using Tick Cell Lines	27679414
PMC5024527	2016	46658	Maintenance of host DNA integrity in field-preserved mosquito (Diptera: Culicidae) blood meals for identification by DNA barcoding	27629021
PMC5010713	2016	51550	Induction of humoral immune response to multiple recombinant Rhipicephalus appendiculatus antigens and their effect on tick feeding success and pathogen transmission	27589998
PMC5008119	2016	56924	Substrate prediction of Ixodes ricinus salivary lipocalins differentially expressed during Borrelia afzelii infection	27584086
PMC5021860	2016	27387	Acute Oral Mammalian Toxicity and Effect of Solvents on Efficacy of Maerua edulis (Gilg. &amp; Ben.) De Wolf against Rhipicephalus (Boophilus) decoloratus Koch, 1844 (Acarina: Ixodidae), Tick Larvae	27660762
PMC4982215	2016	63154	Saliva of Rhipicephalus (Boophilus) microplus (Acari: Ixodidae) inhibits classical and alternative complement pathways	27515662
PMC4997057	2016	45103	Selection of Reference Genes for Expression Studies of Xenobiotic Adaptation in Tetranychus urticae	27570487
PMC4970269	2016	42456	Identification of a novel beta-adrenergic octopamine receptor-like gene (betaAOR-like) and increased ATP-binding cassette B10 (ABCB10) expression in a Rhipicephalus microplus cell line derived from acaricide-resistant ticks	27484910
PMC5441314	2016	89557	The control of East Coast fever of cattle by live parasite vaccination: A science-to-impact narrative	28616483
PMC5141265	2016	28810	Vaccines and immunization strategies for dengue prevention	27436365
PMC4942781	2016	29417	A sodium channel inhibitor ISTX-I with a novel structure provides a new hint at the evolutionary link between two toxin folds	27407029
PMC4939049	2016	27173	Trypanocidal activity of ethanolic extracts of Commiphora swynnertonii Burtt on Trypanosoma congolense	27392030
PMC4938952	2016	77997	Immunomodulatory effects of tick saliva on dermal cells exposed to Borrelia burgdorferi, the agent of Lyme disease	27391120
PMC4938418	2016	87630	Evaluation of Reference Genes for Reverse Transcription Quantitative PCR Studies of Physiological Responses in the Ghost Moth, Thitarodes armoricanus (Lepidoptera, Hepialidae)	27392023
PMC4936727	2016	47347	Phylogenetic Variants of Rickettsia africae, and Incidental Identification of "Candidatus Rickettsia Moyalensis" in Kenya	27387337
PMC4935670	2016	56690	Limited genetic and antigenic diversity within parasite isolates used in a live vaccine against Theileria parva	27080723
PMC4918217	2016	65584	Analyses of mitochondrial genes reveal two sympatric but genetically divergent lineages of Rhipicephalus appendiculatus in Kenya	27334334
PMC4918789	2016	28039	Fluorescent membrane markers elucidate the association ofBorrelia burgdorferi with tick cell lines	27332772
PMC4894869	2016	30511	Evasins: Therapeutic Potential of a New Family of Chemokine-Binding Proteins from Ticks	27375615
PMC4910358	2016	26552	Growth of Ehrlichia canis, the causative agent of canine monocytic ehrlichiosis, in vector and non-vector ixodid tick cell lines	26837859
PMC4873194	2016	64458	East Coast Fever Caused by Theileria parva Is Characterized by Macrophage Activation Associated with Vasculitis and Respiratory Failure	27195791
PMC4836144	2016	69513	Tick-borne pathogens of zoonotic and veterinary importance in Nigerian cattle	27090756
PMC5411820	2017	78247	Conservation of indigenous cattle genetic resources in Southern Africa's smallholder areas: turning threats into opportunities - A review	27004814
PMC4804572	2016	41078	Factors associated with Anaplasma spp. seroprevalence among dogs in the United States	27004557
PMC4801386	2016	122089	A Deep Insight into the Sialome of Male and Female Aedes aegypti Mosquitoes	26999592
PMC4793754	2016	55419	Paralog analyses reveal gene duplication events and genes under positive selection in Ixodes scapularis and other ixodid ticks	26984180
PMC4794910	2016	22703	Molecular detection and identification of piroplasms in sika deer (Cervus nippon) from Jilin Province, China	26984286
PMC4792108	2016	64669	Matrix-assisted laser desorption/ionization time of flight mass spectrometry for comprehensive indexing of East African ixodid tick species	26979606
PMC4821805	2016	88297	Acquisition of exogenous haem is essential for tick reproduction	26949258
PMC4773007	2016	52808	Absolute Quantification of the Host-To-Parasite DNA Ratio in Theileria parva-Infected Lymphocyte Cell Lines	26930209
PMC4766707	2016	26800	Cattle tick vaccine researchers join forces in CATVAC	26911668
PMC4752215	2016	67169	Temporal Gene Expression Analysis and RNA Silencing of Single and Multiple Members of Gene Family in the Lone Star Tick Amblyomma americanum	26872360
PMC4809068	2016	33054	Tofla virus: A newly identified Nairovirus of the Crimean-Congo hemorrhagic fever group isolated from ticks in Japan	26863911
PMC4748274	2016	44414	Multiple functions of Na/K-ATPase in dopamine-induced salivation of the Blacklegged tick, Ixodes scapularis	26861075
PMC4709002	2016	148349	Ixodes scapularis Tick Saliva Proteins Sequentially Secreted Every 24 h during Blood Feeding	26751078
PMC4906742	2016	23385	Ectoparasites of Stray Dogs in Mazandaran, Gilan and Qazvin Provinces, North and Center of Iran	27308294
PMC4906735	2016	33847	Immunization of Cattle with Tick Salivary Gland Extracts	27308287
PMC4700616	2016	59925	Emergence of multi-acaricide resistant Rhipicephalus ticks and its implication on chemical tick control in Uganda	26727991
PMC4684871	2015	22255	Evaluation of In Vivo Acaricidal Effect of Soap Containing Essential Oil of Chenopodium ambrosioides Leaves on Rhipicephalus lunulatus in the Western Highland of Cameroon	26770829
PMC7158325	2016	715974	Special Senses	
PMC4650922	2015	42368	Differential sialotranscriptomes of unfed and fed Rhipicephalus haemaphysaloides, with particular regard to differentially expressed genes of cysteine proteases	26577685
PMC4650338	2015	22156	Insights into the development of Ixodes scapularis: a resource for research on a medically important tick species	26576940
PMC5434826	2015	72409	Review: Capripoxvirus Diseases: Current Status and Opportunities for Control	26564428
PMC4664984	2015	51559	Potential for Co-Infection of a Mosquito-Specific Flavivirus, Nhumirim Virus, to Block West Nile Virus Transmission in Mosquitoes	26569286
PMC4831916	2015	90749	Cofeeding intra- and interspecific transmission of an emerging insect-borne rickettsial pathogen	26414611
PMC4592253	2015	138655	Lipopolysaccharide-Induced Differential Expression of miRNAs in Male and Female Rhipicephalus haemaphysaloides Ticks	26430879
PMC4763323	2015	33634	Bacteria associated with Amblyomma cajennense tick eggs	26537602
PMC4589125	2015	60706	Molecular detection and characterization of Babesia bovis, Babesia bigemina, Theileria species and Anaplasma marginale isolated from cattle in Kenya	26420543
PMC4540598	2015	25111	Propagation of the Israeli vaccine strain of Anaplasma centrale in tick cell lines	26210950
PMC4586012	2015	45918	An in vitro model to assess the immunosuppressive effect of tick saliva on the mobilization of inflammatory monocyte-derived cells	26412247
PMC4583173	2015	78147	The genomes of three stocks comprising the most widely utilized live sporozoite Theileria parva vaccine exhibit very different degrees and patterns of sequence divergence	26403690
PMC7123991	2015	120194	Types of Recombinant Vaccines	
PMC4574146	2015	19854	Host-feeding behaviour of Dermacentor reticulatus and Dermacentor marginatus in mono-specific and inter-specific infestations	26381387
PMC4589832	2015	49056	The African buffalo parasite Theileria. sp. (buffalo) can infect and immortalize cattle leukocytes and encodes divergent orthologues of Theileria parva antigen genes	26543804
PMC4699983	2015	40287	Climate change, biodiversity, ticks and tick-borne diseases: The butterfly effect	26835253
PMC4540005	2015	45163	To beat or not to beat a tick: comparison of DNA extraction methods for ticks (Ixodes scapularis)	26290800
PMC7131559	2015	45451	Enteric viral infections in lambs or kids	26321129
PMC4530934	2015	59660	ATP Binding Cassette Transporter Mediates Both Heme and Pesticide Detoxification in Tick Midgut Cells	26258982
PMC4529112	2015	95585	Selection and Evaluation of Tissue Specific Reference Genes in Lucilia sericata during an Immune Challenge	26252388
PMC4710712	2015	32395	Molecular detection of zoonotic tick-borne pathogens from ticks collectedfrom ruminants in four South African provinces	26227797
PMC4510899	2015	42208	Cost analysis of options for management of African Animal Trypanosomiasis using interventions targeted at cattle in Tororo District; south-eastern Uganda	26198109
PMC6138072	2015	52633	Questing ixodid ticks on the vegetation of sable antelope and multi-herbivore enclosures in Thabazimbi	26244584
PMC4486961	2015	39426	Signatures of positive selection in East African Shorthorn Zebu: A genome-wide single nucleotide polymorphism analysis	26130263
PMC4491418	2015	46979	Characterisation of Dermanyssus gallinae glutathione S-transferases and their potential as acaricide detoxification proteins	26112960
PMC4484640	2015	97654	Saliva from nymph and adult females of Haemaphysalis longicornis: a proteomic study	26104117
PMC4482097	2015	42636	Molecular characterisation of the tick Rhipicephalus microplus in Malaysia: new insights into the cryptic diversity and distinct genetic assemblages throughout the world	26104478
PMC4825278	2015	66130	Ethnoecological knowledge of ticks and treatment of tick-borne diseases among Maasai people in Northern Tanzania	27065643
PMC4474930	2015	33975	Non-Invasive Delivery of dsRNA into De-Waxed Tick Eggs by Electroporation	26091260
PMC4471175	2015	50050	A Virulent Babesia bovis Strain Failed to Infect White-Tailed Deer (Odocoileus virginianus)	26083429
PMC6138067	2015	58678	Distribution of endemic and introduced tick species in Free State Province, South Africa	26244582
PMC7158200	2015	781331	Single-Stranded RNA Viruses	
PMC4443554	2015	63476	Tick-borne diseases of bovines in Pakistan: major scope for future research and improved control	25994588
PMC4437466	2015	38896	Exposure of vaccinated and naive cattle to natural challenge from buffalo-derived Theileria parva	26005635
PMC4469961	2015	52221	In Vitro effect of the ethanolic extract of Tephrosia Vogelii on Rhipicephalus Sanguineus in Abomey-Calavi 	26101758
PMC4412674	2015	30248	Vaccination against Bm86 Homologues in Rabbits Does Not Impair Ixodes ricinus Feeding or Oviposition	25919587
PMC4478265	2015	48705	In Vivo Analgesic and Antipyretic Activities of N-Butanol and Water Fractions of Ocimum Suave Aqueous Leaves Extract in Mice	26124621
PMC4370414	2015	78507	Metagenomic Profile of the Viral Communities in Rhipicephalus spp. Ticks from Yunnan, China	25799057
PMC4643819	2015	132136	Co-infections determine patterns of mortality in a population exposed to parasite infection	26601143
PMC4357865	2015	37461	Tissue- and time-dependent transcription in Ixodes ricinus salivary glands and midguts when blood feeding on the vertebrate host	25765539
PMC4774835	2015	72288	Tick-borne infections in human and animal population worldwide	27047089
PMC4352250	2015	25517	Functional characterization of a cystatin from the tick Rhipicephalus haemaphysaloides	25889816
PMC4329317	2015	38897	Lumpy skin disease: Attempted propagation in tick cell lines and presence of viral DNA in field ticks collected from naturally-infected cattle	25468765
PMC4359563	2015	31419	Identification and comparative analysis of subolesin/akirin ortholog from Ornithodoros turicata ticks	25889484
PMC4384799	2015	23785	Proteomic Screening of Antigenic Proteins from the Hard Tick, Haemaphysalis longicornis (Acari: Ixodidae)	25748713
PMC4340882	2015	42933	Rhipicephalus microplus and Ixodes ovatus cystatins in tick blood digestion and evasion of host immune response	25889092
PMC4356872	2015	64322	Complex interactions within the ectoparasite community of the eastern rock sengi (Elephantulus myurus)	25830115
PMC4412645	2015	43510	Molecular evolution of a central region containing B cell epitopes in the gene encoding the p67 sporozoite antigen within a field population of Theileria parva	25673078
PMC4275877	2015	105370	Experimental strategies for the identification and characterization of adhesive proteins in animals: a review	25657842
PMC4324834	2015	30448	Native strains of Beauveria bassiana for the control of Rhipicephalus sanguineus sensu lato	25651851
PMC4302575	2015	49975	Tick-borne haemoparasites in African buffalo (Syncerus caffer) from two wildlife areas in Northern Botswana	25589064
PMC4307336	2015	52311	Non-Classical Gluconeogenesis-Dependent Glucose Metabolism in Rhipicephalus microplus Embryonic Cell Line BME26	25594873
PMC4304185	2015	48493	Immunosuppressive effects of Amblyomma cajennense tick saliva on murine bone marrow-derived dendritic cells	25586117
