pmcid	year	count	title	pubmedid
PMC3294693	2006	36034	Potential Arbovirus Emergence and Implications for the United Kingdom	16704800
PMC1315344	2005	85424	Evolution and origin of merlin, the product of the Neurofibromatosis type 2 (NF2) tumor-suppressor gene	16324214
PMC1891629	2005	12676	A secondary structural common core in the ribosomal ITS2 (internal transcribed spacer) of          Culexspecies from diverse geographical locations	17597853
PMC528868	2004	31341	The prevalence of serum antibodies to tick-borne infections in Mbale District, Uganda: The effect of agro-ecological zone, grazing management and age of cattle	15861224
PMC3023448	2003	7986	Rickettsia aeschlimannii in Spain: Molecular Evidence in Hyalomma marginatum and Five Other Tick Species that Feed on Humans	12899141
PMC2732514	2002	3702	Rickettsia aeschlimannii: A New Pathogenic Spotted Fever Group Rickettsia, South Africa	12141981
PMC2589325	1991	3594	Thesis Abstracts 1991	
